title,release_date,rating,description,metascore
Kenshi,2011-11-21,Rating not found,"A free-roaming squad based RPG. Focusing on open-ended sandbox gameplay features rather than a linear story. Be a trader, a thief, a rebel, a warlord, an adventurer, a farmer, a slave, or just food for the cannibals. Research new equipment and craft new gear.",75
Stray Gods: The Roleplaying Musical,2023-08-10,Rating not found,"Gods. Romance. Murder. Musical Numbers?! Play as Grace in a world where Greek Gods live in hiding among us. Change your fate as you draw friends, foes & lovers into song using your powers of musical persuasion to unravel the mystery of the Last Muse's death.",75
Infinite Space,2010-03-16,T,"Infinite Space is a role-playing game in which players assemble a spaceship armada and embark on a cosmic adventure that allows them to delve deep into the vast outer reaches of space, exploring a universe filled with planets and interstellar organizations each with their own culture. Infinite Space follows the story of Yuri, a young crewman that journeys the galactic frontier and slowly moves up the ranks to become captain of his own spaceship fleet. Using over 150 blueprints, players build and customize a huge array of space ships and have over 200 crewmen to recruit. Players battle their way through space to become the strongest fleet in the galaxy while exploring new planets and solar systems. Infinite Space delivers replay value with an epic storyline containing multiple branching story arcs that weave together seamlessly to create one epic tale set amongst the stars. The game also features multiplayer combat through local wireless connection for up to two players. [Sega]",75
The Denpa Men 3: The Rise of Digitoll,2014-05-08,E,"Denpa Men are all around you. Find and catch them to form a party and take them on an exciting adventure!

The Denpa Men are mysterious creatures that live among radio waves. Invisible to the naked eye, they can only be seen and caught by looking through your Nintendo 3DS. In this game, catch Denpa Men, form your team, and head out on an exciting adventure across the world. All to save a special someone!

This time, some Denpa Men can capture monsters, turning them into allies who can be summoned to your side. Capture powerful monsters to turn the tide of battle. Also, your Denpa Men friends now have their own little homes, which can be customized and decorated to suit your style.

Network play is now better than ever. Trade items with players worldwide, and lend or borrow Denpa Men. You can import your hero and bring all your friends from the previous two THE DENPA MEN titles, too.",75
Evil Islands: Curse of the Lost Soul,2001-04-17,T,"Employing the hack-n-slash formula made popular by Blizzard's ""Diablo II,"" this action role-playing fantasy features a character named Zak who awakens with amnesia on a primitive island barely clothed and initially carrying only a bronze knife and must slaughter countless monsters on the quest for his identity.",74
Shin Megami Tensei: Devil Summoner - Raidou Kuzunoha vs. the Soulless Army,2006-10-10,M,"(Known in Japan as ""Devil Summoner: Kuzunoha Raidou"")   Raidou Kuzunoha is a private detective in Japan's Taishou Period of the 1910s and 1920s, but he's much more than just a well-dressed crime scene investigator; he also has the power to capture and conjure demons to do his bidding. Take control of Raidou and his otherworldly companions, guide them through thrilling episodes of action and intrigue, and learn the incredible secrets of the Soulless Army. Detailed real-time combat sequence with swords, guns, combo attacks, and devilish helpers. Photorealistic graphics that transport the player to 1920s Japan. Puzzle-solving with the use of carefully chosen demonic powers. Character design by legendary illustrator Kazuma Kaneko. [Atlus]",74
RPG Time: The Legend of Wright,2022-08-18,E10,"It's time for adventure! When school's out, it's RPG time!

Let's play an RPG that's hand-drawn by a game-loving boy named Kenta, who drew it all on his notebook. Fun and exciting gimmicks and tricks appear every time you turn the page!

While the game's title contains the term ""RPG,"" players will soon find themselves playing games other than the hand-drawn RPG on a notebook: a world made from cardboard and stationary strewn across a desk will also have players play action, adventure, side-scrolling shooters, and command battle games! The game is absolutely chock full of Kenta's playful imagination!

Taking fifteen years to conceive and 9 years to develop, ""RPG Time: The Legend of Wright"" is packed with its creators' ideas and entertaining flourishes.",74
Dead In Vinland,2018-04-12,Rating not found,"Dead in Vinland is a survival/management game, mixed with RPG and adventure elements, focusing on a Viking family trying their level best to survive on a mysterious island. Exiled on a faraway and unknown land, lead Eirik and his family on their quest to survive. Manage their physical and mental health, explore the island, organize your camp and deal with other human beings. Some will help you, and some will be less... friendly. Unveil the esoteric mysteries of Vinland. They could save your life… or lead you to your demise.",74
Driftmoon,2012-10-02,Rating not found,Driftmoon is an adventure RPG that is a cross between an adventure game and an RPG.,73
Paper Sorcerer,2013-11-02,Rating not found,"Paper Sorcerer is a first-person turn-based RPG with adventure game elements inspired by Wizardry, Dungeons and Dragons, and Shadowgate.",73
Fantasy Life,2014-10-24,E10,"A world where you live the life you have always wanted to lead. FANTASY LIFE is an original RPG for the Nintendo 3DS from LEVEL-5, featuring music by Nobuo Uematsu and image illustration by Yoshitaka Amano. 
Set in a beautiful and vast open world, players create their own avatars and take up a vocation of their choosing, living out their lives as they see fit. You can set out on an adventure to save the world, or spend your days in leisurely pursuits such as cooking or fishing. Find the meaning of your new life in the limitless possibilities that reside in FANTASY LIFE on the Nintendo 3DS.",73
Monster Lab,2008-11-04,E10,"Monster Lab is set in an eerie, supernatural world where the evil Baron Mharti rules the region with a cruel hand. Gamers take on the role of an apprentice scientist who must perform a vast array of intricate experiments to create creepy monsters from over 150 monster parts. From mechanical to biological to alchemical laboratories, players take control of their monstrous creations and explore the land, searching for ingredients to make stronger monster parts, hunting out and defeating enemy monsters, discovering quests to embark upon or simply competing in the numerous mini-games available. Monster Lab gives players the ability to challenge and compete with friends in ferocious multiplayer combat and collect monster parts and recipes in an obsessive pursuit of knowledge and power. The ultimate goal is to vanquish the evil Baron Mharti and liberate the villagers through mastering experiments, creating a powerful army of monsters and conquering all of the vast environments. Only then will the player rise through the ranks and become a Mad Scientist worthy of defeating the Baron! [Eidos Interactive]",73
Dokapon Kingdom,2008-10-14,E10,"The King of Dokapon has offered you his throne; all he asks for in return is that you dispose of an invading horde of thieving monsters. Trouble is - you're not the only one he asked. Contend with up to three friends as you navigate playfields littered with challenges, monsters to defeat, and rare secrets to unlock. Warning: Relationship counseling not included. Tired of shallow gameplay in party games? The genre gets retooled in this exuberant mix of role playing and board games! Encounter zany characters, collect rare items, and explore a fascinating kingdom on your quest to vanquish monsters, gather treasure, and level up! Turn the heat up on your rivalries! Take on up to three other soon-to-be-ex-friends in the race for Princess Penny and the crown. Battle, steal, deface – playing dirty is the name of the game – through a variety of locales and challenges. After your friendships are broken, the game is just as much fun to play alone. Tons of battles, magic spells, mini-games, and multiple play modes add up to endless replayability. Easy, intuitive, and effective combat system – This is no boring game of hack-and-slash. Players covertly choose their actions in an intuitive battle interface that guarantees every fight will surprise. [Atlus USA]",73
Underrail,2012-12-05,Rating not found,"Underrail is an old-school turn-based isometric indie role playing game that focuses on exploration and combat. The game is set in a distant future, when the life on the Earth’s surface has long since been made impossible and the remnants of humanity now dwell in the Underrail, a vast system of metro station-states.",72
Ray Gigant,2016-05-03,T,"This adventure is set in the not-too-distant future... Earth’s major cities have been ravaged by giant, terrifying creatures known as Gigants. Across the globe,  military forces from every nation attempted to counter the attacks but, to their horror, failed miserably. In a twist of fate, it was reported that a boy named Ichiya Amakaze defeated a Gigant. The boy defeated the Gigants using a mysterious power called the Yorigami. This victory was short-lived, however. Ichiya lost control of his power and tragically destroyed the city he tried so hard to protect. After this fateful experience, he fell unconscious. Ichiya was then detained and sent to a safe location where his fate would soon unfold...",72
The Dungeon of Naheulbeuk: The Amulet of Chaos,2020-09-17,M,"Step into the wacky heroic fantasy universe of the Dungeon of Naheulbeuk. Lead a team of unlikely and clumsy heroes in an epic and challenging tactical RPG. Live an adventure filled with humor, surprises and silly encounters.",72
Zanki Zero: Last Beginning,2019-04-09,M,"Play from the POV of one of eight protagonists in each chapter and explore the dungeons, towers, and islands to uncover the deadly sins of the protagonists' pasts. Hunt for materials & food while fending off monsters in real-time battle environments; but don't forget to eat, sleep, & go to the bathroom (seriously, it's bad for your health & fatal for your party). With every life cycle lasting only 13 days, each clone’s stats, abilities, and capabilities differ as they grow from youths to old age.",72
Potion Permit,2022-09-22,E,"The town of Moonbury has always been wary of the advances of the outside world, preferring to rely on their traditional methods of healing. Until one day, when the mayor's daughter falls ill, and the local witch doctor can do nothing to help her, they are forced to look outside their small community for help.

The Medical Association decides to send their most accomplished chemist - you - to help cure the mayor's daughter and convince the residents of Moonbury of the wonders of modern alchemy. Gain their trust and tend to each person when they fall ill in this open-ended sim RPG.",72
Metal Max Xeno Reborn,2022-06-10,T,"Humanity is on the brink of extinction and the last remaining survivors look to push back against the machines.

Half a century ago of war against the mother computer NOA has reduced even Asia's largest metropolis, TOKIO, to rubble.

Explore this desolate wasteland and battle your way through onslaughts of enemies. Salvage, modify and hit back using tanks, weaponry and faithful battle dog, Pochi, to reclaim a future for the human race!

Set in a devastated world called Dystokio, Metal Max Xeno: Reborn is a nonlinear, open world, JRPG with real-time battle and vehicle combat elements. Take control of Talis and search for other survivors who wish to fight back against the machines of NOA. There are no limits to where you can go, no matter your progression in the game.",72
Fairy Tail,2020-07-31,T,"Fight for Your Guild with Powerful Magical Abilities in FAIRY TAIL. FAIRY TAIL, based on Hiro Mashima's best-selling manga and anime series of the same name, follows the spell-binding plot from ""The Grand Magic Games"" story arc -- enabling gamers to re-live, or experience for the first time, the exciting episodes of this fan-favorite storyline. Not only will they be able to experience stories previously told in the manga and anime, but they will even be able to enjoy never before seen story and quest elements.

Throughout their journey, players will be able to form a party from a selection of over ten iconic characters, including: the fire dragon slayer, Natsu Dragneel; the celestial mage, Lucy Heartfilia; the ice-make mage, Gray Fullbuster; the fairy queen 'Titania', Erza Scarlet; and the young sky dragon slayer, Wendy Marvell. With a wealth of guild members to recruit to their party, players can form their own dream team even including an unlikely group of allies for their own unique adventure.

The fiery and intense magical battles from the series are breathtakingly brought to life in FAIRY TAIL's environment; with a diverse range of magic available for the extraordinary characters to wield. Renowned moves from the series light up the screen, with some characters such as Natsu being able to take advantage of mode changes like utilizing the eye-popping Lightning Fire Dragon Mode. In addition, some guild members will be available to support in battle; including the Fairy Tail Guild Master, Makarov Dreyar, who can be called in to provide powerful aid on the battlefield.

In FAIRY TAIL, completing battles and quests will not only level up party members, it will lead to character bonding scenarios, provide options to upgrade the guild, and eventually raise the 'Guild Rank' enabling players to take on more challenging missions in their quest to become the greatest guild in Fiore.",71
Stranger of Sword City,2016-04-26,T,"STRANGER OF SWORD CITY is the next step in the evolution of the traditional dungeon RPG genre. This title contains the three core elements of attraction for dungeon RPGs: character creation, conquering various dungeons, and dungeon crawling gameplay. Furthermore, our experience and know-how with a large number of titles within the Dungeon RPG genre has allowed us to create enhanced support features that allow our users to enjoy the title to their hearts content. Players can switch between the beautiful and fantastical art style of Yoko Tsukamoto, or the art style of Oxijiyen, an artist renowned for their cute character graphics, for the NPC illustrations in game.",71
Miitopia,2021-05-21,E,"Since the dawn of ever, warriors have banded together to fight evil. Now… Mii characters based on your favorite people must unite to do turn-based battle and save Miitopia. Cast them in roles across the kingdom, manage friendships, and give them jobs with distinct stats, abilities, gear, and a custom look. Then behold as awesomeness unfolds. Guide your team of Mii characters on a quest to defeat the Dark Lord and restore the stolen faces of the citizens of Miitopia. As you watch with bated breath, Mii characters will mingle over food, camping, exercise, sleeping arrangements, and yes, combat! In these wild, yet traditional RPG battles, your party’s relationships affect the outcome. Enemies attack while you explore the world map, which is littered with hidden paths and treasures. [Nintendo]",71
Knuckle Sandwich,2023-11-22,Rating not found,"Knuckle Sandwich is a turn-based RPG by Andy Brophy. Get a job, beat up some monsters, and solve a mystery that's plaguing Bright City.",70
Dead State,2014-12-04,Rating not found,"Dead State is a high-tension survival RPG set at the beginning of the zombie apocalypse. As society begins to fall apart, the player must organize a scant handful of allies, working on fortifying a shelter, scouting for food and supplies, making uncertain alliances with others, and attempting to hold together a group as humanity teeters on the brink of extinction. A full-fledged RPG featuring shelter building and management, turn-based tactical combat, and reactive story and dialogue with an emphasis on survival at any cost. Attract new allies, scavenge food and supplies, and protect your shelter at any cost. Do you have what it takes to lead a desperate group through a crisis? This is your chance to find out.",70
New World,2021-09-28,T,"Fate has summoned you to the shores of Aeternum, the Eternal Isle. Overcome the brutal legions of The Corrupted and draw battle lines with competing players in this land of danger and opportunity. In a land hell-bent on your destruction, what will you do to survive? Strike out alone to forge your own heroic path, or band together, fortify, and fight.",70
Septerra Core: Legacy of the Creator,1999-10-31,T,"You are Maya, a junk scavenger, surviving on refuse dumped from above. Yours is a world of layers, in which continents orbit at different elevations around the planet. Those at the top, the Chosen, consume massive amounts of energy and dump their waste down to the layers below. Now they have begun a descent to the Core, a living computer, in their search for the Gift of the Creator, fabled to bestow great power. At first you stand in the way of the Chosen, fighting to slow their march to the Core, and protect your homeland. But it is you who will ultimately discover Septerra's true nature, as you journey out of the familiar surroundings of your home country, and come face to face with the Legacy... [Monolith Productions]",70
Harry Potter and the Prisoner of Azkaban (2004),2004-05-25,E,"The Dementors are coming... and this time Harry needs his friends. Play as Harry, Ron and Hermione. Face the Dementors. All new mini games.",69
Born of Bread,2023-12-05,E10,"Beings from another age are causing havoc across the land! And with their mischief comes a great threat to everyone. The unlikeliest hero, a golem born of bread, will find himself and his newfound friends in the middle of a drama that's thousands of years in the making. Together, they will visit incredible locals and meet fascinating characters, from the mysterious ruins of the Forest of Roots to the frozen landscapes of Frosty Flats. Although he may not look like much, Loaf might be the hero this land kneads.",69
Siege Survival: Gloria Victis,2021-05-18,Rating not found,"A medieval city under siege and a handful of civilians are all that keep the walls from falling. Mixing survival strategy and resource management, build your camp, craft supplies, and scavenge the occupied city to supply the last troops holding back the invaders.",69
Runespell: Overture,2011-07-20,Rating not found,Runespell: Overture is a Poker/Yahtzee type game with power ups and collectible cards.,69
Vagante,2022-01-27,T,Vagante is an actionplatformer that features permanent death and procedurally generated levels. Play cooperatively with friends or adventure solo in this challenging roguelike-inspired game.,69
Pokemon Ranger: Guardian Signs,2010-10-04,E,Guardian Signs is the third installment in the Pokemon Ranger series.,68
RPGolf Legends,2022-01-20,E,"Become the legend in this golf-action-adventure and save golf in the world!

An evil force has sealed all the golf holes in the world! Join forces with the spirit of a golf club and embark on a fantastic action-golfing adventure to save golf in the world!

Travel around in a unique open-world where monsters and golf coexist, get your best scores in 6 unique environments and beat monsters! When you are resting, do not forget to help people with their quests... every encounter counts!

Thanks to the class system, you will also get new skills, special items and a brand new look!
Whether you spend your time golfing, fishing, crafting or exploring... is entirely up to you.

A fantastic journey is about to start!",68
Pokemon Ranger: Shadows of Almia,2008-11-10,E,"In Pokemon Ranger: Shadows of Almia, you once again play as a Pokemon Ranger, working to help people, Pokemon and nature in a new area called the Almia Region. Starting out as a Student Ranger, you quickly earn the title of a full-fledged Pokemon Ranger. As you succeed in more and more missions, you will aspire to become the highest Ranger rank: Top Ranger. Along the way you meet and capture all kinds of different Pokemon. [Nintendo]",68
The Legend of Heroes: A Tear of Vermillion,2005-11-15,T,"The game is a single-player turn-based role-playing game featuring more than 100 unique characters to interact with, over 50 hours of gameplay and a deeply involving story line that unfolds in one of  beautifully crafted 3D environments.  Known by the name: Eiyuu Densetsu (""Legend of Heroes"") Gagharv Trilogy: Akai Shizuku (""Crimson Tears"") in Japan, the game is developed by legendary Nihon Falcom in Tokyo. The company is well known for their RPG work on many platforms and brands, including the ""Ys"", ""Brandish"" and ""Sorcerian Series."" While faithful to the ""Legend of Heroes"" series, players unfamiliar with the story will discover an easy-to-pick-up gameplay experience. [Bandai]",68
Nelke & the Legendary Alchemists: Ateliers of the New World,2019-03-26,E10,"As players work hard to build Westwald up from a quaint village to a flourishing city, they will require the aid of the many alchemists that settle in the town. Features famous alchemists from previous entries across the Atelier series, including those from the Salburg, Arland, Dusk, and Mysterious trilogies. Celebrates the series' 20th anniversary; allowing players to experience the beloved series' characters with an exciting new town-building focus.",67
Criminal Girls 2: Party Favors,2016-10-11,M,"Return to the depths of Hell, and guide a brand-new group of Delinquents through the Reformation Program. This time around, there’s a twist. One of the girls in your group of seven isn’t quite what she seems. As you journey through the Hell Spire, you’ll have to deal with the seeds of mistrust as you struggle to unite your team and overcome their sins and the bonds of damnation. Uncover each girl’s unique story, and shape them into the women they need to be in order to find redemption. [NIS America]",67
Rhapsody: A Musical Adventure,2008-09-23,E,"Enter the world of Rhapsody, where music and action combine to create a charming adventure. A remake of the PlayStation original, Rhapsody: A Musical Adventure for Nintendo DS delivers high-resolution 2D sprites, innovative music-based RPG gameplay, and more features than ever before. New features exclusive to the DS version include dual screen navigation and unlockable characters not previously available. Experience a wonderful symphony of RPG fun! [NIS America]",67
"My World, My Way",2009-02-03,E,"Elise is a beautiful princess who has been given everything she’s ever wanted. Upon turning 15, she realizes there’s only one thing in the world she lacks - a handsome boyfriend. She sets out to remedy this by asking her father to hold a ball in her honor, to which every prince from every kingdom is invited to come and try their hand at wooing her. However, only one young man catches Elise’s eye, and, as it turns out, he is no prince, but an adventurer. Knowing that fate itself has ordained him as her true love, she confesses her desire to share in his exciting life... Only to be flat out rejected. He tells her, ""If it is truly your desire is to be with an adventurer such as me, I would ask you first to do something with that long hair. Cast aside that frilly dress, and don a suit of armor. Gain some experience in battle, and when you have matured, we shall meet again. Until then, I bid you farewell."" And so, much to the Kingdom’s shock and dismay, Elise, the clueless princess, sets out on her adventure! It’s her world, her way, and as long as she can help the weak, slay the monsters, and win enough fame, she’ll get her happily ever after! Alter the landscape to get your way! Different terrain options will open up different opportunities for new enemies and items, and give you power over your adventure. Pouting is power, and developing your selfishness is key to getting the Pout Points that will give you options to force the world to behave.  Delight in the off-the-wall journey of a spoiled princess whose selfishness fuels her ability to successfully become an adventurer. [Atlus USA]",67
Monark,2022-02-22,T,"How far will you go to save the ones you love? Could you face the threats that surround you? Could you face yourself? Your world is plunged into madness when the mysterious and deadly Mist surrounds Shin Mikado Academy. In order to save your friends, you enter the Otherworld, a Daemon-filled dimension beyond the real world. Within this enigmatic realm, you must learn to harness your Authority of Vanity and conjure a battalion of Fiends, whose power comes from the Ego of their master. Develop your Ego through various psychological tests to enhance the power of your Fiends, and lead your forces into battle to fight with and against the seven ""Pactbearers"" that are corrupting the academy. Embrace the power of your madness to gain strength, but take care not to delve too far, lest you risk losing yourself. Fellow students and instructors will lend you their aid in your quest to resolve the anomalies throughout the campus.",66
