title,release_date,rating,description,metascore
Phantasy Star Online,2001-01-29,T,"Pioneer 2 finally completed it's long voyage to the new home world. But as the ship entered orbit, an enormous explosion shook the entire planet, and all contact with the thousands of people already there was lost. Now, in the first worldwide online console RPG, players from around the globe must unite to discover what has happened. Phantasy Star Online continues in the tradition of one of the most popular series of all time, and becomes a revolutionary and truly global gaming experience in an online, persistent world.",89
Stardew Valley,2016-02-26,E10,"Stardew Valley is an RPG-style farming game. It's up to you to choose your path... Will you devote your time to raising crops and caring for animals? Will you spend time in the local village, befriending the local townspeople? Do you get a kick out of slaying dreadful monsters in the mysterious mountain caverns? Or will you try to accomplish everything and claim the coveted title of Stardew Hero?",89
South Park: The Stick of Truth,2014-03-04,M,"South Park: The Game is an epic role-playing adventure that will allow the user to befriend Stan, Kyle, Cartman and Kenny and explore the quiet little mountain town like never before. 

From the perilous battlefields of the 4th-grade playground, a young hero will rise, destined to be South Park’s savior. From the creators of South Park, Trey Parker and Matt Stone, comes an epic quest to become… cool. Introducing South Park: The Stick of Truth. For a thousand years, the battle has been waged. The sole reason humans and elves are locked in a neverending war: The Stick of Truth. But the tides of war are soon to change as word of a new kid spreads throughout the land, his coming foretold by the stars. As the moving vans of prophecy drive away, your adventure begins. Arm yourself with weapons of legend to defeat crabpeople, underpants gnomes, hippies, and other forces of evil. Discover the lost Stick of Truth and earn your place at the side of Stan, Kyle, Cartman, and Kenny as their new friend. Succeed, and you shall be South Park’s savior, cementing your social status in South Park Elementary. Fail, and you will forever be known… as a loser. [Ubisoft]",85
In Stars And Time,2023-11-20,Rating not found,"What would you do if you were forced to relive your failures over and over again?

In Stars and Time tells the story of Siffrin and their adventurer friends - a found family bound together by fate in order to end the tyrannical reign of an evil king. But as victory is just within the party's grasp, a tragedy occurs, the clock resets, and they have to do it all again.

As Siffrin's the only one who notices this loop, each new start wears away at his cheerful veneer, yet he keeps going in hopes he can end this temporal tragedy once and for all.

In Stars and Time is a time-looping RPG adventure. With each loop, Siffrin gains a new perspective on the world around them, opening up new solutions to puzzles and allowing them to make better choices in conversation. 

Equip memories as armor, pray to the Change God to improve your team's capabilities each loop, and challenge deadly foes to Rock, Paper, Scissors as Siffrin seeks the truth.",85
West of Loathing,2018-05-31,T,West of Loathing — a slapstick comedy stick-figure wild west adventure role-playing game.,85
Pyre,2017-07-25,E10,"Pyre is a party-based RPG from the creators of Bastion and Transistor. Lead your band of exiles to freedom through a series of mystical competitions in the Campaign, or challenge a friend to a fast-paced ritual showdown in the head-to-head Versus Mode.",85
Shin Megami Tensei V,2021-11-12,M,"The ambitions of god and human clash amidst the horror of a dying world. Neither human nor demon, the newly-forged Nahobino and his friends must decide what is worth saving... and prepare to sacrifice everything in its name. In a world without its Creator, which path will you choose?",84
Space Rangers 2: Rise of the Dominators,2006-03-27,T,"200 years after the first chapter for Space Rangers, a new, even more dangerous threat arises in the galaxy. A key planet producing war androids has become self-aware and is attempting to conquer the galaxy one planet at a time. These machines are not only capable of fulfilling any order, but they have their own intellect and force of will. This new type of cyber life is driven only by instinct of destruction and cares only about expanding the realm of the silicate. Freedom of choice is a distinguishing feature of the Space Rangers saga and continues as players explore the massive world. The game is not limited by borders and allows players an opportunity to influence the branching storyline. At the same time, the larger and more expansive game world lives and develops by itself. In Space Rangers 2 players will have an opportunity to test their skills not only in outer space, but on planets' surfaces as well. 3D real-time battles on planets is a new part of the game. By producing and upgrading war machines, gamers have a chance to defeat the ominous threat of the Dominators. [1C Company]",84
Darkest Dungeon,2015-02-03,Rating not found,"Darkest Dungeon is a gothic roguelike RPG dungeon crawler about the psychological stresses of adventuring. You will lead a band of four heroes on a perilous side-scrolling descent, dealing with a prodigious number of threats to their bodily health, and worse, a relentless assault on their mental fortitude! Five hundred feet below the earth you will not only fight unimaginable foes, but famine, disease, and the stress of the ever-encroaching dark. Darkest Dungeon focuses on the humanity and psychological vulnerability of the heroes and asks: What emotional toll does a life of adventure take?",84
Little Goody Two Shoes,2023-11-07,T,"Set in the mysterious Kieferberg Village, Little Goody Two Shoes is a homage to the original PlayStation and early PlayStation 2 RPGs and is centered around Elise, an ambitious girl determined to become rich and escape her humble life.

Players will step into Elise's shoes and soon find themselves immersed in a 90s inspired horror role-playing adventure game. Gameplay elements such as ""Sustenance,"" ""Reputation & Suspicion,"" and ""Exploration & Narrative"" will guide players to complete their daily tasks by day and uncover the woodland's darkest secrets by night.

Players will also have the ability to set their own paths to navigate through the wicked woods, solve puzzles and build meaningful relationships in this nostalgic gaming experience.",84
Fuga: Melodies of Steel,2021-07-29,Rating not found,"""We have to fight! If we don't, everyone we love will be taken away!"" One fateful night, a peaceful village is thrown into the flames of war. Determined to save their families, a group of children boards a giant tank and begins an offensive charge! Fuga: Melodies of Steel is an RPG where you place children, each with their own unique characteristics and skills, at different gun turrets in a tank to fight against the enemy.

Living inside the tank, the children show emotion and gain affinity amongst each other. Manage these both to change the outcome of their journey!

-A mysterious ancient weapon: The Taranis
Taranis, the giant tank sheltering the children, conceals many mysteries and somehow seems to have its own will. In situations of crisis, it can release a forbidden weapon, the dreadful Soul Cannon.

-Your adventure. Your choices.
Will you make sacrifices for victory? Or will you seek another path?
In this RPG, many choices have to be made in order to progress...but taking the safest road may not always be the best option. 

Faced with a desperate situation, what course of action will you choose?",84
Half-Minute Hero,2009-10-13,E10,"As the last wandering sage and final hope for humanity, it is up to the protagonist to somehow transcend time and death to unite these legends and their unique powers in one last battle against the ultimate evil lord. Fast-paced Action for Instant Gratification - A fresh new way to play games, clearing stages in 30-second intervals. Four Completely Different and Unique Game Play Modes - Four distinct storylines and modes that encompass an action RPG, a shooter, an escort mission, and a strategy game, keep the gameplay fresh and varied. [Xseed]",84
LISA: Definitive Edition,2023-07-18,M,"After a mysterious event known only as the “White Flash” wipes out all women in existence, warlords, imbeciles and perverts are left to rule the world of Olathe. Follow Brad’s relentless journey through the barren wasteland making sacrifices and cutting off arms to save party members, fighting through countless unique monster and enemy encounters, beating up old friends and past traumas and doing whatever it takes to save his daughter, the last girl alive…",83
Roadwarden,2022-09-12,Rating not found,"A brave stranger putting your life on the line to make a difference in this grim fantasy world. While most people would never risk a solitary journey through the wilder parts of the land, you willingly accept the struggle. You guard travellers, connect isolated villages, support merchants, and repel attacking creatures, bandits, or even undead.

A powerful merchant guild has called on your services, sending you on a journey into the unknown planes of a mysterious peninsula in the hopes to expand the guild's influence even further.

Explore this world and gather as much information as possible to reveal the secrets surrounding the area. It's a dangerous task, but an equally respectable one.

Roadwarden is an illustrated text-based RPG that uses isometric pixel art and combines mechanics borrowed from RPGs, Visual Novels, adventure games, and interactive fiction, such as inventory puzzles, dialogue choices, character abilities and progression, hit points. simple survival mechanics. or quests restricted by in-game time.",83
Eastward,2021-09-16,T,"In the near-future, society is starting to collapse, and the human population is at an all-time low. A deadly toxic presence has spread across the land, destroying and devouring everything in its path.

Those who could escape the miasma flocked to underground villages to start a new life. But for a hardworking miner and a mysterious young girl, the hope of a thriving outside world beckons

Escape the tyrannical clutches of Sandfill's subterranean society and join Eastward's unlikely duo on an exciting adventure to the land above! 

Discover beautiful yet bizarre settlements and make new friends as you travel across the world by rail.",82
Legend of Grimrock,2012-04-11,Rating not found,"Legend of Grimrock is a dungeon crawling game inspired by oldschool classics of the genre while still bringing its own twists to the game. The game features survival, combat, magic, puzzles and role-playing elements. The player is a prisoner sentenced to death and exiled to the secluded Mount Grimrock for vile crimes he may or may not have committed. Unbeknownst to his captivators, the mountain is riddled with ancient tunnels and dungeons. The player's mission is to form a team and escape by descending through the mountain, level by level. During the journey the player encounters mysterious puzzles, deadly traps, ancient tombs and horrible monsters left behind by crumbled civilizations long perished now. Find out more at http://www.grimrock.net",82
Child of Light,2014-04-29,E10,"Child of Light is a digital download, 2D side-scrolling role-playing game inspired by the art style of Studio Ghibli.",82
Loop Hero,2021-03-04,Rating not found,"The Lich has thrown the world into a timeless loop and plunged its inhabitants into never ending chaos. Wield an expanding deck of mystical cards to place enemies, buildings, and terrain along each unique expedition loop for the brave hero.",82
Darkest Dungeon: The Crimson Court,2017-06-19,T,"Darkest Dungeon®: The Crimson Court is the first expansion for the award-winning grim and gothic RPG by Red Hook Studios. Crimson Court is a parallel campaign experienced alongside the main Darkest Dungeon content that will provide you with new challenges and variation at every difficulty level. The narrative grounding sheds some light on the Ancestor’s early days, and will be presented in the same style of cut-scenes you’ve seen elsewhere in the game.",82
Symphony of War: The Nephilim Saga,2022-06-10,Rating not found,"Enter Tahnra, a land savaged by war. You, a fresh academy graduate with humble beginnings, will grow to lead a grand army against a corrupt adversary. Gather heroes, form bonds, and lead your force in turn-based battles. Make use of tactics, terrain, morale and more to bring peace to the land!",81
Everhood,2021-03-04,E10,An UNCONVENTIONAL ADVENTURE RPG that takes place in an inexpressible world filled with amusing musical battles and strange delightful encounters. To put it simply: You are in for a ride.,81
My Time at Sandrock,2023-11-02,E10,"My Time at Sandrock-Just like My Time at Portia, takes place in a wholesome post-apocalyptic world around 300 years after the Day of Calamity.

You'll take a job offer in the city-state of Sandrock, assume the role of a fledgling Builder being sent to a wild and rugged townscape. It's up to you and your trusty toolset to gather resources, build machines, and fix up your workshop into a well-oiled production machine, and save the town from the jaws of economic ruin, as well as a few other unexpected complications.

Key Features:

CUSTOMIZE AND BUILD YOUR WORKSHOP: You'll have an intricate set of machines that all work together to produce parts of huge structures for the town that you assemble piece by piece, or head to your worktable to craft hundreds of unique items that can help out individual townspeople or be placed throughout your own homestead.

EXPLORE THE OPEN WORLD: You'll explore the vast deserts surrounding Sandrock, diving into ruins to find ancient relics from the Old World, facing the dangers of dungeons and their denizens, then return to your homestead with encumbering bags of treasure in tow. 

MORE ELABORATE STORY AND DEEPER CHARACTERS: a vastly enriched storyline, hundreds of side-quests boasting over 30 completely new characters, each getting more attention than before with their own story to discover, as well as the return of a few familiar faces for fans of the series. 

NEW COMBAT: a revamped combat system that allows the player to quickly shift between melee combat and 3rd person shooting mechanics.

SKILL UP: Level up your character with a variety of skills to aid you in your adventures. Decide on whether to boost your crafting, combat or social skills depending on your play style.

AND THERE'S MORE: You'll take your profits and convert the empty prairie lands around you into farmable land for a more leisurely lifestyle, then sell your crops, or transform them into delicious dishes. There is an original soundtrack with dynamic in-game music that reflects where the player is and what they're doing. 

You will find everything you enjoyed about My Time at Portia and more, and you will feel right at home in the delightful life-sim RPG that is My Time at Sandrock.",81
Honkai: Star Rail,2023-04-26,T,"Honkai: Star Rail features a game world awaiting discovery with elements of myths and legends blended into the space sci-fi story. 
 
Honkai: Star Rail invites players to board the Astral Express and travel across unique worlds, each filled with different adventures and surprises. During the whirlwind trip of a star-chasing ride, players will meet new companions as well as faces familiar to series fans, resolving [Stellaron]-related conflicts, and eventually unraveling the mysteries concealed within.

This role-playing game features a newcomer-friendly strategic turn-based combat system and large maps and mazes involving puzzle-solving and exploration, providing players with epic combat and a journey of discovery full of surprises and rewards.",80
Ruined King: A League of Legends Story,2021-11-16,T,"Rise Against Ruin. Unite a party of League of Legends Champions, explore Bilgewater and set sail for the Shadow Isles to uncover the secrets of the deadly Black Mist. Developed by Airship Syndicate and featuring the art style of legendary comic book artist Joe Madureira, creators of Battle Chasers and Darksiders, Ruined King: A League of Legends Story is the first Riot Forge game that invites you to explore the League of Legends universe. In this immersive turn-based RPG, you will have the freedom to configure your party and control an unlikely group of League of Legends champions, explore the bustling city of Bilgewater and the mysterious Shadow Isles, and experience the Lane Initiative System.",80
Granblue Fantasy: Relink,2024-02-01,T,"""There's always more to explore in this big, blue world Let me show you!""

The journey continues from your smartphone to your PlayStation 4. Captivating character designs and beautiful environments from CyDesignation, the artists behind the original Granblue Fantasy, come to life in 3D by way of PlatinumGames.

PlatinumGames and Cygames are teaming up to create a new story starring beloved characters from Granblue Fantasy sure to delight Granblue and action game fans alike.",80
Paper Mario: The Origami King,2020-07-17,E,"Featuring a new ring-based battle system that mixes puzzle-solving skills with traditional turn-based combat, Paper Mario: The Origami King aims to put new twists in the series' established formula.",80
Phantasy Star Online Ver. 2,2001-09-24,T,"The realm of Phantasy Star Online has increased. Phantasy Star Online Ver. 2 includes all of the original content, and expands the world with more levels, more features, and more evil to combat. Master the Ultimate Difficulty setting, survive the Challenge Dungeon, and reign as the champion of Battle Mode. The evolution of the original revolutionary gaming experience continues.",80
South Park: The Fractured But Whole,2017-10-17,M,"South Park: The Fractured but Whole empowers players to delve into the tender, crime-ridden underbelly of South Park with Coon and Friends. This dedicated group of crime fighters was formed by Eric Cartman, whose superhero alter ego, The Coon, is half man, half raccoon. As The New Kid, players join Mysterion, Toolshed, Human Kite, Mosquito, Mint Berry Crunch and a group of others to battle the forces of evil while Coon strives to make his team some of the most beloved superheroes in history. Creators Matt Stone and Trey Parker were involved in every step of the development of the game. [Ubisoft]",79
Shin Megami Tensei: Devil Summoner 2: Raidou Kuzunoha vs. King Abaddon,2009-05-12,M,"A new threat to Japan's Capital calls for the return of its case-solving, tube-slinging Devil Summoner: Raidou Kuzunoha the 14th. When a woman walks into the Narumi Detective Agency and asks to find a man, Raidou's boss is reluctant to accept, but soon it's clear there's more to the case than it seems on the surface. It isn't long before Raidou is on the trail of crooked gamblers, masked ninja, and strange insects... a trail leading him inexorably to the mysterious King Abaddon. Massively upgraded battle system - Advancements to the battle mechanics include a MAG balancing system, dodge and hide abilities, and the ability to command two demons in combat. Use the retooled Weapon Alchemy system to create new swords with unique special attacks. Deeper demon integration - Demon negotiation returns with more than twice the number of demons to attempt to recruit to your side. Create more powerful demons through fusion and skill transfer. Control two demons in battle and choose from more tactical options. [Atlus USA]",79
Rune Factory Frontier,2009-03-17,E10,"From the creators of Harvest Moon and Rune Factory for the DS comes the first installment of Rune Factory for a home console. Developed exclusively for Wii, Rune Factory: Frontier takes full advantage of the Wii's unique controls to fully immerse players in the Rune Factory universe. Rune Factory: Frontier incorporates an open-ended structure that allows players to choose the type of game they wish to experience. Whether it's growing crops, expanding the town, fighting (or befriending) monsters or even falling in love, the experience is unique to each player. [XSEED]",79
The Denpa Men: They Came By Wave,2012-09-27,E,"The Denpa Men: They Came By Wave is a role-playing game in which you collect Denpa Men to form a party, and use this party to explore dungeons.",78
World of Horror,2023-10-19,Rating not found,Experience the quiet terror of this 1-bit love letter to Junji Ito and H.P. Lovecraft. Navigate a hellish roguelite reality with turn-based combat and unforgiving choices. Experiment with your deck of event cards to discover new forms of cosmic horror in every playthrough. The inevitable awaits...,78
The King's Dilemma: Chronicles,2023-01-30,Rating not found,"Lead the King’s Council for generations as the consequences of your decisions decide the kingdom’s resources and political standing. Form alliances, solve dilemmas, and prepare for the final uprising that was foretold by an ancient prophecy",78
Oreshika: Tainted Bloodlines,2015-03-03,T,"Oreshika is a tale of revenge that takes place in ancient Japan. Your clan was sentenced to death for crimes they did not commit, and then had two curses placed on them. You have just been resurrected by a god and are now searching for those who cursed and conspired against your clan so that you may redeem the honor of your family name. [Playstation.com]",78
Expeditions: Conquistador,2013-05-30,Rating not found,Expeditions: Conquistador is a story-driven tactical roleplaying game with a touch of strategic resource management and a pinch of choose-your-own-adventure.,77
Rune Factory 2: A Fantasy Harvest Moon,2008-11-18,E,"Rune Factory 2 is set several years after the first game. The evil Sechs Empire has been defeated, and the Kingdom of Norad is once again at peace. Things may not stay that way for long, however, as dark premonitions foretell of dangers to come.  It's up to player to uncover the source of these premonitions and bring peace to the kingdom once more. Over the course of the story, players will build and develop a farm, befriend townspeople, raise monsters, take on quests, and find a wife. Rune Factory 2 offers innovative Touch Screen controls, easy-to-use menus, and an all-new compelling storyline. In a first for the Rune Factory series, the story of Rune Factory 2 is multigenerational. Players begin the game as Kyle, a strange man who comes to Alvarna Village. Eventually, players will take on the role of Kyle's child, opening up a whole new adventure. It's an innovative feature that allows players to follow the story of their family and the townsfolk over two generations. [Natsume]",77
moon: Remix RPG Adventure,2020-08-27,E10,"Moon is full of so many subtleties in the characters, their strange personalities, and idiosyncratic ways of communicating. We wanted to do even more testing than usual to make sure all of that came through clearly, felt special, and guided you properly through its world.",77
LISA,2014-12-15,M,The miserable journey of a broken man...,77
Wolfstride,2021-12-07,Rating not found,"Wolfstride is a role-playing game about three former partners-in-crime coming to a turning point in their lives. When they inherit a junkyard mecha called Cowboy, they reunite to enter the planet's most elite mecha competition: the Ultimate Golden God Tournament.

Each member of the team lends their unique experience as they prepare to outwit the best mecha opponents from around the world. Between dog-mechanic Duque, mecha pilot Knife Leopard, and jack-of-all-trades Dominique Shade, the core crew's got just about everything covered.

That is... until their simple mission to make money unfolds into a deep, slow-burning exploration of their complex lives, the dark choices of their past, and their inevitable fate",76
Riviera: The Promised Land,2005-06-28,T,"1000 years have passed since Ragnarok, the war between Asgard, realm of the gods, and Utgard, home of the demons. Recently, the floating island of Riviera has been showing signs of the demons’ return. With the gods no longer present, another Ragnarok would mean certain doom for Asgard. The decision had been made to evoke the Retribution and destroy Riviera; the Grim Angels Ein and Ledah were appointed as the executors of this task. Now, two angels descend upon the Promised Land. [Atlus Software]",76
The Denpa Men 2: Beyond The Waves,2013-05-30,E,"The Denpa Men are mysterious little creatures that float around radio waves. They all have their own territory. You can't see them with the naked eye, but you can use your 3DS to find them and catch them.

In this RPG, you can form a team of the Denpa Men you caught and take them on an exciting adventure across the world, in order to save the hero's family. Many wonders and strong enemies await you on your journey!
This game supports StreetPass as well. By passing other players, you can exchange your party information and increase the amount of time you have to explore special dungeons.

You can even battle online now! All you have to do is register for battle, and you'll be able to fight other players at any time you want. Keep winning to earn phenomenal prizes!

If you played the previous game, &quot;THE 'DENPA' MEN: They Came By Wave,&quot; you'll be able to transfer your hero and you'll even be able to bring all of your friends from the previous game into this one!",76
Crimson Shroud,2012-12-13,T,"Follow the tale of a young ""Chaser"" named Giauque, as he and his team find themselves drawn into the mystery of the Original Gift, the Crimson Shroud.",76
