title,release_date,rating,description,metascore
The Legend of Zelda: Ocarina of Time,1998-11-23,E,"As a young boy, Link is tricked by Ganondorf, the King of the Gerudo Thieves. The evil human uses Link to gain access to the Sacred Realm, where he places his tainted hands on Triforce and transforms the beautiful Hyrulean landscape into a barren wasteland. Link is determined to fix the problems he helped to create, so with the help of Rauru he travels through time gathering the powers of the Seven Sages.",99
SoulCalibur,1999-09-08,T,"This is a tale of souls and swords, transcending the world and all its history, told for all eternity... The greatest weapons-based fighter returns, this time on Sega Dreamcast. Soul Calibur unleashes incredible graphics, fantastic fighters, and combos so amazing they'll make your head spin!",98
Grand Theft Auto IV,2008-04-29,M,"[Metacritic's 2008 Xbox 360 Game of the Year; Also known as ""GTA IV""]  What does the American Dream mean today? For Niko Belic, fresh off the boat from Europe. It's the hope he can escape his past. For his cousin, Roman, it is the vision that together they can find fortune in Liberty City, gateway to the land of opportunity. As they slip into debt and are dragged into a criminal underworld by a series of shysters, thieves and sociopaths, they discover that the reality is very different from the dream in a city that worships money and status, and is heaven for those who have them an a living nightmare for those who don't. [Rockstar Games]",98
Super Mario Galaxy,2007-11-12,E,"[Metacritic's 2007 Wii Game of the Year] The ultimate Nintendo hero is taking the ultimate step ... out into space. Join Mario as he ushers in a new era of video games, defying gravity across all the planets in the galaxy. When some creature escapes into space with Princess Peach, Mario gives chase, exploring bizarre planets all across the galaxy. Mario, Peach and enemies new and old are here. Players run, jump and battle enemies as they explore all the planets in the galaxy. Since this game makes full use of all the features of the Wii Remote, players have to do all kinds of things to succeed: pressing buttons, swinging the Wii Remote and the Nunchuk, and even pointing at and dragging things with the pointer. Since he's in space, Mario can perform mind-bending jumps unlike anything he's done before. He'll also have a wealth of new moves that are all based around tilting, pointing and shaking the Wii Remote. Shake, tilt and point! Mario takes advantage of all the unique aspects of the Wii Remote and Nunchuk controller, unleashing new moves as players shake the controller and even point at and drag items with the pointer. [Nintendo]",97
Super Mario Galaxy 2,2010-05-23,E,"Super Mario Galaxy 2, the sequel to the galaxy-hopping original game, includes the gravity-defying, physics-based exploration from the first game, but is loaded with entirely new galaxies and features to challenge players. On some stages, Mario can pair up with his dinosaur buddy Yoshi and use his tongue to grab items and spit them back at enemies. Players can also have fun with new items such as a drill that lets our hero tunnel through solid rock. [Nintendo]",97
The Legend of Zelda: Breath of the Wild,2017-03-03,E10,"Ignore everything you know about The Legend of Zelda games. Step into a world of discovery, exploration and adventure in The Legend of Zelda: Breath of the Wild. Travel across fields, through forests and to mountain peaks as you discover what has become of the ruined kingdom of Hyrule in this stunning open-air adventure. Explore the wilds of Hyrule any way you like - Climb up towers and mountain peaks in search of new destinations, then set your own path to get there and plunge into the wilderness. Along the way, you'll battle towering enemies, hunt wild beasts and gather ingredients for the food and elixirs you'll need to sustain you on your journey. More than 100 Shrines of Trials to discover and explore - Shrines dot the landscape, waiting to be discovered in any order you want. Search for them in various ways, and solve a variety of puzzles inside. Work your way through the traps and devices inside to earn special items and other rewards that will help you on your adventure. Be prepared and properly equipped - With an entire world waiting to be explored, you'll need a variety of outfits and gear to reach every corner. You may need to bundle up with warmer clothes or change into something better suited to the desert heat. Some clothing even has special effects that, for example, can make you faster and stealthier. [Nintendo]",97
Tony Hawk's Pro Skater 3,2001-10-30,T,Challenge up to four friends in online competitions over a LAN or the Internet.  Take them on in both Trick Attack and Graffiti modes. [Activision],97
Red Dead Redemption 2,2018-10-26,M,"Developed by the creators of Grand Theft Auto V and Red Dead Redemption, Red Dead Redemption 2 is an epic tale of life in America’s unforgiving heartland. The game’s vast and atmospheric world also provides the foundation for a brand new online multiplayer experience. America, 1899. The end of the Wild West era has begun. After a robbery goes badly wrong in the western town of Blackwater, Arthur Morgan and the Van der Linde gang are forced to flee. With federal agents and the best bounty hunters in the nation massing on their heels, the gang has to rob, steal and fight their way across the rugged heartland of America in order to survive. As deepening internal fissures threaten to tear the gang apart, Arthur must make a choice between his own ideals and loyalty to the gang that raised him. [Rockstar]",97
Grand Theft Auto V,2014-11-18,M,"The sprawling sun-soaked metropolis of Los Santos is chock full of self-help coaches, starlets and C-List celebrities, once on top of the media world, now struggling to stay relevant in time of economic malaise and lowest-common-denominator reality TV. Amidst this madness, three unique criminals plan their own chances of survival and success: Franklin, a street-level hustler in search of opportunities for serious money; Michael, an ex-con whose ""retirement"" is a less rosy than he hoped it would be; and Trevor, a violent dude driven by the chance for a quick high and the next big score. Nearly out of options, the crew risks it all in a series of daring and dangerous heists that could set them up for life - one way or the other.",97
Metroid Prime,2002-11-17,T,"Samus returns in a new mission to unravel the mystery behind the ruined walls scattered across Tallon IV. In Metroid Prime, you'll play the role of this bounty hunter and view the world through her visor, which displays information ranging from current energy levels to ammunition. Equipped with a Power Beam and Gravity Suit, you must shoot locked switches, solve puzzles, and eliminate enemies. It's up to you to explore the world and recover more power-ups and weapons, which gradually open more gameplay areas.",97
Grand Theft Auto III,2001-10-22,M,"Players are put at the heart of their very own gangster movie, and let loose in a fully-realised 3 dimensional city with a cast of hundreds, 50 plus vehicles, ranging from sports cars to ice cream trucks and from boats to buses, 3 hours of music, including opera, reggae, house, drum and bass, pop and disco, and a huge array of street ready weapons.  [Rockstar Games]",97
Super Mario Odyssey,2017-10-27,E10,"New Evolution of Mario Sandbox-Style Gameplay. Mario embarks on a new journey through unknown worlds, running and jumping through huge 3D worlds in the first sandbox-style Mario game since Super Mario 64 and Super Mario Sunshine. Set sail between expansive worlds aboard an airship, and perform all-new actions, such as throwing Mario's cap.",97
Halo: Combat Evolved,2001-11-15,M,"In a desperate attempt to keep a conquering alien race called the Covenant from finding Earth, you--a cybernteically enhanced soldier representing the peak of human military evolution--and a ragtag group of Marines flee to a distant uncharted system where you unexpectedly stumble across Halo, an enormous alien artifact in orbit between a gas giant and its moon. Your objective: Uncover Halo's horrible secret, and destroy mankind's nemesis - the Covenant. [Microsoft]",97
NFL 2K1,2000-09-07,E,"In the end, NFL 2K1 is a deeper, more refined version of the original game.",97
Half-Life 2,2004-11-16,M,"[Metacritic's 2004 PC Game of the Year]  By taking the suspense, challenge and visceral charge of the original, and adding startling new realism and responsiveness, Half-Life 2 opens the door to a world where the player's presence affects everything around him, from the physical environment to the behaviors -- even the emotions -- of both friends and enemies. The player again picks up the crowbar of research scientist Gordon Freeman, who finds himself on an alien-infested Earth being picked to the bone, its resources depleted, its populace dwindling. Freeman is thrust into the unenviable role of rescuing the world from the wrong he unleashed back at Black Mesa. And a lot of people -- people he cares about -- are counting on him. [Vivendi Universal]",96
BioShock,2007-08-21,M,"[Metacritic's 2007 Xbox 360 Game of the Year] Going beyond ""run and gun corridors,"" ""monster-closet AIs"" and static worlds, BioShock creates a living, unique and unpredictable FPS experience. After your plane crashes into icy uncharted waters, you discover a rusted bathysphere and descend into Rapture, a city hidden beneath the sea. Constructed as an idealistic society for a hand picked group of scientists, artists and industrialists, the idealism is no more. Now the city is littered with corpses, wildly powerful guardians roam the corridors as little girls loot the dead, and genetically mutated citizens ambush you at every turn. Take control of your world by hacking mechanical devices, commandeering security turrets and crafting unique items critical to your very survival. Upgrade your weapons with ionic gels, explosives and toxins to customize them to the enemy and environment. Genetically modify your body through dozens of Plasmid Stations scattered throughout the city, empowering you with fantastic and often grotesque abilities. Explore a living world powered by Ecological A.I., where the inhabitants have interesting and consequential relationships with one another that impact your gameplay experience. Experience truly next generation graphics that vividly illustrate the forlorn art deco city, highlighted by the most detailed and realistic water effects ever developed in a video game. Make meaningful choices and mature decisions, ultimately culminating in the grand question: do you exploit the innocent survivors of Rapture...or save them? [2K Games]",96
GoldenEye 007,1997-08-25,T,You are Bond. James Bond. You are assigned covert operations connected with the GoldenEye weapons satellite. M will brief you on your mission and objectives from London. Q Branch will support your efforts with a plentiful supply of weapons and gadgets. Moneypenny offers you light-hearted best wishes and you're off! Your mission begins in the heavily guarded chemical warfare facility at the Byelomorye Dam in the USSR. Look and shoot in any direction as you navigate 12 interactive 3-D environments. Use stealth and force as you see fit in matters of international security. Consider the military personnel expendable. You are licensed to kill!,96
Uncharted 2: Among Thieves,2009-10-13,T,"Fortune hunter Nathan Drake returns in Uncharted 2: Among Thieves, a third-person action-adventure/shooter created by award-winning developer Naughty Dog. Down on his luck, Drake is lured back into the treacherous world of thieves and mercenary treasure-seekers he had sought to leave behind. When a mysterious artifact propels Drake on an expedition to find the legendary Himalayan valley of Shambhala, he finds himself embroiled in a dangerous game of cat-and-mouse against a fugitive war criminal who’s after more than just the fabled riches of the lost city. Caught in a web of deception and plunged into an increasingly deadly pursuit that tests the limits of his endurance, Drake will be forced to risk everything - but has his luck finally run out? [SCEA]",96
Baldur's Gate 3,2023-08-03,M,"An ancient evil has returned to Baldur's Gate, intent on devouring it from the inside out. The fate of Faerun lies in your hands. Alone, you may resist. But together, you can overcome. Gather your party and return to the Forgotten Realms in a tale of fellowship and betrayal, sacrifice and survival, and the lure of absolute power. Mysterious abilities are awakening inside you, drawn from a mind flayer parasite planted in your brain. Resist, and turn darkness against itself. Or embrace corruption, and become ultimate evil.",96
Resident Evil 4 (2005),2005-01-11,M,"Resident Evil 4 marks a new chapter in the Resident Evil series. You'll rejoin Leon S. Kennedy six years after his first mission as a rookie cop from Resident Evil 2. Now a US agent, Leon is on a top secret mission to investigate the disappearance of the president's daughter. As Leon, you must make your way to a mysterious location in Europe, where new enemies await. Take them down by using enhanced aim-and-shoot features and a new action button.",96
The Orange Box,2007-10-10,M,"Games included in The Orange Box compilation: The original Half-Life 2 - The player again picks up the crowbar of research scientist Gordon Freeman, who finds himself on an alien-infested Earth being picked to the bone, its resources depleted, its populace dwindling. Freeman is thrust into the unenviable role of rescuing the world from the wrong he unleashed back at Black Mesa. And a lot of people - people he cares about - are counting on him. Half-Life 2: Episode One - The player reprises his role of Dr. Freeman, who must immediately face the repercussions of his actions in City 17 and the Citadel. Freeman reconnects with Alyx Vance and her robot, Dog, as they continue their support of the resistance's battle against the Combine forces.  Half-Life 2: Episode Two -- the second installment in Valve's episodic trilogy advances the award-winning story, leading the player to new locations outside of City 17. Portal - a pioneering type of single player action game that rewrites the rules for how players approach and manipulate their environment – much like how Half-Life 2's Gravity Gun reinvented the way gamers interact with objects in the game. Team Fortress 2 - an all-new version of the legendary title that spawned team based multiplayer action games. The game's daring new art style features the most advanced graphics of any Source-based game released to date. [Valve Software]",96
Tekken 3,1998-04-29,T,"An ancient evil force has reawakened, attacking in secret and feeding on the souls of mighty warriors. To lure it out of hiding will take the greatest fighting contest the world has ever seen...Tekken 3. Some are fighting for revenge, some for honor, Ultimately, all are fighting for their lives and the fate of all mankind.",96
Mass Effect 2,2010-01-26,M,"The Mass Effect trilogy is a science fiction adventure set in a vast universe filled with dangerous alien life forms and mysterious uncharted planets. In this dark second chapter, Saren’s evil army of Geth soldiers has just been defeated, and humans, who are still struggling to make their mark on the galactic stage, are now faced with an even greater peril. [BioWare]",96
The House in Fata Morgana - Dreams of the Revenants Edition -,2021-04-09,M,"A gothic suspense tale set in a cursed mansion. ‘The House in Fata Morgana’ is a full-length visual novel spanning nearly a millennium that deals in tragedy, human nature, and insanity. This version includes three games and more:
    1: The House in Fata Morgana: the main storyline.
    2: A Requiem for Innocence: a prequel shedding light on the origins of Fata Morgana’s terrible curse.
    3: Reincarnation: a sequel featuring the central cast members reincarnated in the present day. *The part including voices
    4: Other additional short stories.",96
Elden Ring,2022-02-25,M,"A New World Created By Hidetaka Miyazaki And George R. R. Martin

ELDEN RING, developed by FromSoftware, Inc. and BANDAI NAMCO Entertainment Inc., is a fantasy action-RPG adventure set within a world created by Hidetaka Miyazaki creator of the influential DARK SOULS video game series; and George R.R. Martin author of The New York Times best-selling fantasy series, A Song of Ice and Fire. Danger and discovery lurk around every corner in FromSoftware's largest game to-date. 

Hidetaka Miyazaki, President and Game Director of FromSoftware Inc. Known for directing critically-acclaimed games in beloved franchises including Armored Core, Dark Souls, and Sekiro: Shadows Die Twice. 

George R.R. Martin is the #1 New York Times bestselling author of many novels, including the acclaimed series A Song of Ice and Fire - A Game of Thrones, A Clash of Kings, A Storm of Swords, A Feast For Crows, and A Dance with Dragons. As a writer-producer, he has worked on The Twilight Zone, Beauty and the Beast, and various feature films and pilots that were never made.",96
The Elder Scrolls V: Skyrim,2011-11-11,M,"The next chapter in the Elder Scrolls saga arrives from the Bethesda Game Studios. Skyrim reimagines the open-world fantasy epic, bringing to life a complete virtual world open for you to explore any way you choose. Play any type of character you can imagine, and do whatever you want; the legendary freedom of choice, storytelling, and adventure of The Elder Scrolls is realized like never before. Skyrim's new game engine brings to life a complete virtual world with rolling clouds, rugged mountains, bustling cities, lush fields, and ancient dungeons. Choose from hundreds of weapons, spells, and abilities. The new character system allows you to play any way you want and define yourself through your actions. Battle ancient dragons like you've never seen. As Dragonborn, learn their secrets and harness their power for yourself.",96
Half-Life,1998-11-19,M,"Half-Life combines great storytelling in the tradition of Stephen King with intense action and advanced technology to create a frighteningly realistic world where players need to think smart to survive. Half-Life has won more than 50 Game of the Year awards from publications around the world, and was named 'Best PC Game Ever' in PC Gamer's November 1999 issue. [Sierra]",96
The Legend of Zelda: Tears of the Kingdom,2023-05-12,Rating not found,"An epic adventure across the land and skies of Hyrule awaits in The Legend of Zelda™: Tears of the Kingdom for Nintendo Switch™. The adventure is yours to create in a world fueled by your imagination. In this sequel to The Legend of Zelda: Breath of the Wild, you’ll decide your own path through the sprawling landscapes of Hyrule and the mysterious islands floating in the vast skies above. Can you harness the power of Link’s new abilities to fight back against the malevolent forces that threaten the kingdom?",96
The Legend of Zelda: The Wind Waker,2003-03-24,E,"AN EVIL WIND IS RISING...

Legend has it that whenever evil has appeared, a hero named Link has arisen to defeat it. The legend continues on the surface of a vast and mysterious sea as Link sets sail in his most epic, awe-inspiring adventure yet. Aided by a magical conductor's baton called the Wind Waker, he will face unimaginable monsters, explore puzzling dungeons, and meet a cast of unforgettable characters as he searches for his kidnapped sister.

* Immerse yourself in a world unlike you've ever seen, as you sail across a vast, unexplored ocean.
* Master a magical conductor's baton known as the Wind Waker to control the wind and much more! 
* Connect to a pal's Game Boy® Advance and play cooperatively -- get hints, uncover secrets, and get help in battle! 
* Use new items like the Grappling Hook and Deku Leaf to take the fight to spectacular, massive bosses. 
* Take on hordes of incredibly animated enemies as you search through riddle-filled dungeons.",96
Gran Turismo,1998-05-12,E,"With authentic cars, courses, and car physics, Gran Turismo 4 adds an even more realistic racing simulation to the series. The characteristics of each car take into account weight, speed, friction, and more to deliver realistic handling. Test-drive new vehicles in courses located in various sites, such as Nurburgring Nordschleife, New York City, the Grand Canyon, and Tsukuba Circuit. The PSP version of Gran Turismo 4 lets you race against your friends via wireless network.",96
Metal Gear Solid 2: Sons of Liberty,2001-11-12,M,"Since the incident on Shadow Moses Island, Metal Gear's top-secret technology has been leaked into the black market through the machinations of Revolver Ocelot. As a result, countless variations of Metal Gears have sprung up in every corner of the globe, making the weapon an increasingly common component of the armed forces of nuclear powers. 
In the midst of all of this, Solid Snake, now a member of the anti-Metal Gear group ""Philanthropy,"" has learned that a new prototype Metal Gear has been developed by the U.S. Marines and is being transported in secret to an unknown destination. To learn more about this new machine, Snake must infiltrate the transport, disguised as a tanker, as it makes its way down the Hudson River. Just as Snake is about to begin his mission, however, the ship is seized by a mysterious and well-armed group bent on stealing the new Metal Gear for their own, nefarious purposes. [Konami]",96
Grand Theft Auto Double Pack,2003-11-04,M,"From the dark and seedy streets of Liberty City's underworld to the glamorous hedonism of Vice City of the 1980s, the Grand Theft Auto double-pack takes you through the huge worlds of Grand Theft Auto III and it's sequel Vice City. The highly controversial Grand Theft Auto III gives you the freedom to go anywhere and jack anyone, putting the dark, intriguing and ruthless world of crime at your fingertips. Vice City is an entirely new game set in the '80s, preserving and adding to the free-roaming gameplay, cinematic graphics and immersive audio experience that made the Grand Theft Auto III so popular.",96
Portal: Companion Collection,2022-06-28,Rating not found,"Including Portal and Portal 2, the Companion Collection comes to Nintendo Switch with all the groundbreaking gameplay, dark humor, and exploration that earned the series hundreds of awards.

In Portal, you'll use a highly experimental portal device to solve physical puzzles and challenges. Maneuver objects--and yourself--through space to puzzle your way through the mysterious Aperture Science Laboratories.

Return to Aperture Laboratories in Portal 2 where you'll once again face off with the lethally inventive, power-mad A.I. named GLaDOS. Meet an expanded cast of characters as you think your way through dangerous, never-before-seen areas of the laboratories and a wider variety of portal puzzles. Plus Portal 2 also includes a co-operative game mode with local, split-screen and online multiplayer so you and a friend can think with portals.",95
Baldur's Gate II: Shadows of Amn,2000-09-24,T,"An epic continuation of the story that began in ""Baldur's Gate,"" this RPG is set along the southern portion of the Sword Coast, a detailed and rich area of the Forgotten Realms called Amn. It features 300 spells and 130-plus monster types compared to only 130 spells and 60 monster types in Baldur's Gate. [Interplay]",95
Grand Theft Auto: San Andreas,2004-10-26,M,"[Metacritic's 2004 PS2 Game of the Year]  Five years ago Carl Johnson escaped from the pressures of life in Los Santos, San Andreas... a city tearing itself apart with gang trouble, drugs and corruption. Where filmstars and millionaires do their best to avoid the dealers and gangbangers. Now, it's the early 90s. Carl's got to go home. His mother has been murdered, his family has fallen apart and his childhood friends are all heading towards disaster. On his return to the neighborhood, a couple of corrupt cops frame him for homicide. CJ is forced on a journey that takes him across the entire state of San Andreas, to save his family and to take control of the streets. [Rockstar]",95
Grand Theft Auto: Vice City,2002-10-29,M,"[Metacritic's 2002 PS2 Game of the Year ] Welcome to Vice City. Welcome to the 1980s. Having just made it back onto the streets of Liberty City after a long stretch in maximum security, Tommy Vercetti is sent to Vice City by his old boss, Sonny Forelli. They were understandably nervous about his re-appearance in Liberty City, so a trip down south seemed like a good idea. But all does not go smoothly upon his arrival in the glamorous, hedonistic metropolis of Vice City. He's set up and is left with no money and no merchandise. Sonny wants his money back, but the biker gangs, Cuban gangsters, and corrupt politicians stand in his way. Most of Vice City seems to want Tommy dead. His only answer is to fight back and take over the city himself. Vice City offers vehicular pleasures to suit every taste. For the speed enthusiast, there's high-performance cars and motorbikes. For the sportsman, a powerboat or a golf buggy lets you enjoy the great outdoors. For those that need that sense of freedom and escape, why not charter a helicopter and see the beauty of Vice City from the air? [Rockstar]",95
