title,release_date,rating,description,metascore
LittleBigPlanet,2008-10-27,E,"In LittleBigPlanet Players meet on a blue and green planet scattered with individual plots – and use their character's amazing abilities to play, create and share what they build with other gamers throughout the world via the Playstation Network. The LittleBigPlanet experience starts with players learning about their character’s powers to interact physically with the environment. There are places to explore, creative resources to collect and puzzles to solve – all requiring a combination of brains and collaborative teamwork. As soon as players begin their creative skills will grow and they will soon be ready to start creating and modifying their surroundings – the first step to sharing them with the whole community.Characters have the power to move anything in this glued and stitched-together 3D landscape; they have the power to design, shape and build both objects and entire locations for others to view and play. There’s no complicated level editor; all of these skills can be learned by simply playing the game. Creativity is part of the gameplay experience and playing is part of the creative experience. Players can make their world as open or as secretive to explore as they like. When it’s ready, they can invite anyone within the LittleBigPlanet community to come and explore their patch – or can go and explore everybody else's. [SCEA]",95
The Legend of Zelda Collector's Edition,2003-11-17,E,"The greatest legend in gaming! The ultimate Zelda collection!

- The Legend of Zelda: Play the game that launched the legend! With an innovative and unique game-play system, remarkably deep puzzle solving, and an epic score, the appeal of this groundbreaking classic is still going strong.

- Zelda II - The Adventure of Link: While adhering to the majestic and puzzle-solving elements of the Legend of Zelda, the second game in the series expands on the action sequences and introduces a new magic system, pushing the series in a new direction.

- The Legend of Zelda: Ocarina of Time: Zelda moved into three dimensions with gorgeous cinematics, hordes of hostile enemies, the revolutionary targeting system, and the freedom of traveling on horseback. Ocarina of Time leaves all who play it breathless and impressed.

- The Legend of Zelda: Majora's Mask: The series again takes a dramatic turn from tradition as Link wanders into a three-day journey in a mysterious parallel world. Majora's Mask challenges players to don magical masks and save a town threatened to be crushed under a menacing moon.

Includes Playable Demo for The Legend of Zelda: The Wind Waker!",95
Gran Turismo 3: A-Spec,2001-07-09,E,"With the addition of two new courses (a downtown Tokyo circuit and the Monte Carlo Grand Prix course), an impressive range of cars (from Vipers to Cooper Minis), and a soundtrack featuring everything from Lenny Kravitz to Jimi Hendrix, this highly anticipated title is finally ready to be driven.",95
Halo 2,2004-11-09,M,"The Covenant alien race threatens to destroy all humankind, and the only thing standing in its way is Master Chief, a genetically enhanced supersoldier. Master Chief returns in Halo 2, which features new vehicles, weapons, environments, and more. This time, you can interact with your environment, wield two weapons at the same time, board opponents' vehicles, and even switch sides to play the role of a Covenant Elite. Halo 2 also supports broadband multiplayer action via Xbox Live.",95
The Legend of Zelda: Majora's Mask,2000-10-25,E,"Thrown into a parallel world by the mischievous actions of a possessed Skull Kid, Link finds a land in grave danger. The dark power of a relic called Majora's Mask has wreaked havoc on the citizens of Termina, but their most urgent problem is a suicidal moon crashing toward the world. Link has only 72 hours to find a way to stop its descent.",95
The Legend of Zelda: A Link to the Past / Four Swords,2002-12-03,E,"Now you have a link to one of the greatest adventures in The Legend of Zelda series.  The Legend of Zelda: A Link to the Past revives the classic SNES game on the Game Boy Advance and adds a new multiplayer mode.  In a Link to the Past, Link travels between the light world and the dark world, conquering fierce monsters and uncovering Hyrule's deepest secrets along the way.  Also included is Four Swords, which lets you play with up to three other players, slashing through dungeons and collecting rupees.  Whether you choose solo or competitive play, The Legend of Zelda will keep you occupied with its brain-bending puzzles and fun swashbuckling action.",95
The Last of Us,2013-06-14,M,"Twenty years after a pandemic radically transformed known civilization, infected humans run amuck and survivors kill one another for sustenance and weapons - literally whatever they can get their hands on. Joel, a salty survivor, is hired to smuggle a fourteen-year-old girl, Ellie, out of a rough military quarantine, but what begins as a simple job quickly turns into a brutal journey across the country.",95
The Legend of Zelda: Twilight Princess,2006-11-19,T,"When an evil darkness enshrouds the land of Hyrule, a young farm boy named Link must awaken the hero - and the animal - within. When Link travels to the Twilight Realm, he transforms into a wolf and must scour the land with the help of a mysterious girl named Midna. Using the power and unique control of the Wii console, The Legend of Zelda: Twilight Princess features precise aiming control using the Wii Remote. The Wii Remote and the Nunchuk controller are used for a variety of game activities, including fishing and special sword attacks. Players ride into battle against troops of foul creatures using an amazing horseback combat system, then take on massive bosses that must be seen to be believed. [Nintendo]",95
Madden NFL 2003,2002-08-12,E,"Take Your Game Online: Access an online community where you can meet, chat, and play head-to-head against other gamers. Audio Dream Team: Dynamic play-by-play and analysis by Madden and Michaels. All-New Mini-camp: Hop on John Madden's Cruiser Tour Bus and travel to all NFL cities to complete skilled tasks. Create-A-Playbook: Customize receiver routes, player formations, and your team's entire playbook. Deepest Franchise Mode Ever: Play 30 years of Franchise mode and draft players each season with tips from your scouts. [EA Sports]",95
Persona 5 Royal,2020-03-31,M,"Prepare for an all-new RPG experience in Persona 5 Royal based in the universe of the award-winning series, Persona! Don the mask of Joker and join the Phantom Thieves of Hearts. Break free from the chains of modern society and stage grand heists to infiltrate the minds of the corrupt and make them change their ways! Persona 5 Royal is packed with new characters, confidants, story depth, new locations to explore, and a new grappling hook mechanic for stealthy access to new areas. With a new semester at Shujin Academy, get ready to strengthen your abilities in the metaverse and in your daily life. Persona 5 Royal presents a unique visual style and award nominated composer Shoji Meguro returns with an all-new soundtrack. Explore Tokyo, unlock new Personas, customize your own personal Thieves Den, discover a never-before-seen story arc, cutscenes, alternate endings, and more! Even for the most seasoned Phantom Thieves among us, Persona 5 Royal is a new challenge to defy conventions, discover the power within, and fight for justice. Wear the mask. Reveal your truth.",95
The Last of Us Remastered,2014-07-29,M,"The Last of Us has been rebuilt for the PlayStation4 system. Now featuring full 1080p, higher resolution character models, improved shadows and lighting, in addition to several other gameplay improvements. 20 years after a pandemic has radically changed known civilization, infected humans run wild and survivors are killing each other for food, weapons; whatever they can get their hands on. Joel, a violent survivor, is hired to smuggle a 14 year-old girl, Ellie, out of an oppressive military quarantine zone, but what starts as a small job soon transforms into a brutal journey across the U.S. The Last of Us Remastered includes the Abandoned Territories Map Pack, Reclaimed Territories Map Pack, and the critically acclaimed The Last of Us: Left Behind Single Player campaign that combines themes of survival, loyalty, and love with tense, survival-action gameplay.

Remastered Features:
-Explore a brutal post-pandemic world, fully realized with the power of PlayStation4 system
-Includes additional game content: over $30 in value
-Delve into Ellies past in Left Behind, the single-player prequel chapter
-Eight new multiplayer maps in the Abandoned and Reclaimed Territories packs
-In-game cinematic commentary from the cast and creative director",95
Red Dead Redemption,2010-05-18,M,"Developed by Rockstar San Diego, as a follow up to the 2004 hit game Red Dead Revolver, Red Dead Redemption is a Western epic, set at the turn of the 20th century when the lawless and chaotic badlands began to give way to the expanding reach of government and the spread of the Industrial Age.  The story of former outlaw, John Marston, Red Dead Redemption takes players on a great adventure across the American frontier. Utilizing Rockstar's proprietary Rockstar Advanced Game Engine (RAGE), Red Dead Redemption features an open-world environment for players to explore, including frontier towns, rolling prairies teeming with wildlife, and perilous mountain passes - each packed with an endless flow of varied distractions. Along the way, players experience the heat of gunfights and battles, meet a host of unique characters, struggle against the harshness of one of the world’s last remaining wildernesses, and ultimately pick their own precarious path through an epic story about the death of the Wild West and the gunslingers that inhabited it. [Rockstar Games]",95
