title,release_date,rating,description,metascore
The Legend of Zelda: Ocarina of Time,1998-11-23,E,"As a young boy, Link is tricked by Ganondorf, the King of the Gerudo Thieves. The evil human uses Link to gain access to the Sacred Realm, where he places his tainted hands on Triforce and transforms the beautiful Hyrulean landscape into a barren wasteland. Link is determined to fix the problems he helped to create, so with the help of Rauru he travels through time gathering the powers of the Seven Sages.",99
Perfect Dark (2000),2000-05-22,M,"Step into the Dark... As Carrington Institute's most promising new Agent, Joanna Dark must uncover the truth behind the dataDyne Corporation's recent technological breakthroughs - breakthroughs which could have serious consequences for mankind.",97
GoldenEye 007,1997-08-25,T,You are Bond. James Bond. You are assigned covert operations connected with the GoldenEye weapons satellite. M will brief you on your mission and objectives from London. Q Branch will support your efforts with a plentiful supply of weapons and gadgets. Moneypenny offers you light-hearted best wishes and you're off! Your mission begins in the heavily guarded chemical warfare facility at the Byelomorye Dam in the USSR. Look and shoot in any direction as you navigate 12 interactive 3-D environments. Use stealth and force as you see fit in matters of international security. Consider the military personnel expendable. You are licensed to kill!,96
The Legend of Zelda: Majora's Mask,2000-10-25,E,"Thrown into a parallel world by the mischievous actions of a possessed Skull Kid, Link finds a land in grave danger. The dark power of a relic called Majora's Mask has wreaked havoc on the citizens of Termina, but their most urgent problem is a suicidal moon crashing toward the world. Link has only 72 hours to find a way to stop its descent.",95
Super Mario 64,1996-09-26,K,"Super Mario 64, the genre-defining Nintendo 64 classic, arrives on the Nintendo DS with all-new features that take full advantage of the new portable system's dual screens, touch screen and wireless multiplayer capability. Play as Mario, Yoshi, Luigi and even Wario. You'll need to use each one's unique abilities to find 150 Power Stars hidden in the castle and grounds. Play through Adventure mode and try your stylus-wielding hand at tons of new touch-sensitive mini-games. Battle up to three friends in Wireless Versus mode, which you can play with only one Super Mario 64 DS game card. Each of the four main characters has multiple jumping moves that cover great horizontal and vertical distances. Each has unique moves: Yoshi can eat enemies and turn them into eggs that he can throw; Mario can punch, kick and wall-jump to great heights; super-strong Wario can break certain blocks; and Luigi can jump incredibly high. Power Flowers give each character even cooler powers, like invisibility, fire breath or the power to float through the air. [Nintendo]",94
Paper Mario,2001-02-05,E,"Mario pals around in an all-new action adventure! Mario's back in his first adventure since Super Mario 64, and this time, Bowser's bent on preventing a storybook ending. When Princess Peach is kidnapped, Mario plots to rescue the seven Star Spirits and rid the Mushroom Kingdom of Koopa's cruel cohorts. As he travels from the tropical jungles of Lavalava Island to the frosty heights of Shiver Mountain, he'll meet up with seven all-new companions... and he'll need help from each one or there'll be no happily ever after.",93
Banjo-Kazooie,1998-06-29,E,"[Xbox Live Arcade]  The classic Nintendo platformer stars a big, goofy honey bear named Banjo who wears tight yellow shorts and carries around a raucous, red-crested breegull named Tooie in his backpack. The bear-and-bird duo must use constant teamwork to rescue Banjo's sister from the evil Gruntilda who wants to steal her beauty.",92
Wave Race 64,1996-11-01,K,"Wave Race 64 is sure to provide some of the most exciting racing you've ever experienced. Feel the pounding and crashing of the waves as you accelerate into straight-aways, whip around the marker buoys and go airborne on the jump ramps. Don't race alone - challenge a friend! Take control in three different modes of play - Championship, Time Trials and Stunt Mode. Nine challenging courses set in exotic locales - race conditions change and the wave action responds to the way both you and your opponents race!",92
Conker's Bad Fur Day,2001-03-04,M,"The day after his 21st birthday bash, Conker's sporting the worst hangover ever, and he just can't seem to find his way home. Prepare to stagger through randy, raunchy, raucous scenarios crammed full of bad manners, twisted humor, and graphic bodily functions. Unless you're a fan of violence, foul language, and racy innuendo, you'd best steer clear of this one.",92
Mario Tennis,2000-08-28,E,"All of your favorite characters hit the court in a wild and wacky multiplayer tennis game from the makers of Mario Golf. Mario, Luigi, Bowser, Peach, Toad, and Donkey Kong lead off the all-star, 14-player line-up. The fast-paced action will have you unleashing vicious volleys, life-saving lobs, ballistic backhands and electrifying super-charged smashes!",91
Mario Golf,1999-06-30,E,"Forget buying expensive golf gear--Mario brings the game to you. Mario Golf features four complete 18-hole courses, 11 golfers, and precise play control. Create your own golfer and build up his or her experience and skill levels by competing in various tournaments and head-to-head matches. The more you play, the stronger and more accurate your golfer becomes. There are many different modes of play in Mario Golf, including a wide variety of minigames designed to challenge even the most level-headed swingers.",91
Rayman 2: The Great Escape,1999-11-06,E,"Enter a massive 3-D action adventure of amazing beauty and challenge. The pirate terror has enslaved the world and only Rayman's speed, agility, and magical powers can save all. Race and battle across 45 intricately designed areas - rainforests, jungles, narrow canyon passes, even into the mighty pirate ship itself.",90
Donkey Kong 64,1999-11-24,E,"K. Rool has kidnapped the Kongs! Can Donkey Kong rescue his friends, reclaim the Golden Bananas and save his homeland from certain doom? Take out some Kremlings with Chunky's Pineapple Launcher or Lanky's Trombone. Float through the air using Tiny's Ponytail Twirl. Even rocket to the sky with Diddy's Jetbarrel!",90
Blast Corps,1997-02-28,K,"A pair of defective nuclear missiles, en route to a safe detonation site, has begun to leak. Badly damaged, the carrier automatically locks onto the most direct route. Clear a path to help the carrier arrive safely. Tons of vehicles are at your disposal. Leave nothing standing or the adventure will end in an earth-shattering explosion! Find the hidden technicians to ensure a safe detonation. Strap on your seat belt, it's going to be a bumpy ride.",90
Banjo-Tooie,2000-11-20,E,The bear and bird’s second outing available in full. Loads of rollicking fun to be had here and with the legendary Stop 'N' Swop feature reinstated. The best use of a backpack in a game ever! [Microsoft],90
Beetle Adventure Racing,1999-02-28,E,"The adventure begins when you leave the road behind! Smashing, bashing fun! Crash and dash! Ultra-fast nitro blast! Go anywhere - choose your own routes, find surprises at every turn! Do anything - grab big-time air, engage in four-car mayhem!",90
Resident Evil 2 (1998),1999-10-31,M,"Ready or not, the terror of Resident Evil 2 is here.  In chapter one, the case of the disastrous T-virus outbreak--a mutagenic toxin designed for biological weapons--was eventually closed but the experiments were far from over.  Control the destiny of Leon Kennedy or Claire Redfield as their nightmare begins when a biotech terror runs rampant in Raccoon City.  Relentless zombies and hideous monsters are all out for a taste of your blood.  If the suspense doesn't kill you, something else will.",89
WWF No Mercy,2000-11-17,T,"Jump into the ring with the biggest, baddest jambronis around and experience brutal WWF action never before seen in a console game! Over 65 WWF superstars, all-new Ladder matches, and all-new Double-Team moves, like the Dudley 3D Deathdrop! Take on the entire Federation in Survival Mode. Take the action out of the ring in 10 different backstage areas!",89
Excitebike 64,2000-04-30,E,"Experience extreme MX! You grind your way through the hairpin turn, a wall of mud exploding in your wake. Your next jump launches you into the air - you pull off a spectacular double no-footed can-can and become an instant legend! In Excitebike 64, you'll find all the high-flying action, heart-stopping stunts and bone-jarring crashes of the extreme sport of motocross. It'll set the daredevil inside you free. 20 stadium tracks and awesome outdoor courses - plus six different riders with six unique styles!",88
Star Fox 64,1997-07-01,K,The Lylat system has been invaded! Join Fox McCloud and his Star Fox team as they fight to save the galaxy from the clutches of the evil Andross. Travel to many different 3-D worlds. Battle the enemy in the air and on the ground and listen in as Fox McCloud interacts with a cast of characters.,88
Diddy Kong Racing,1997-11-24,K,"Timber the Tiger's parents picked a fine time to go on vacation. When they come back, they're going to be faced with an island trashed by the spiteful space bully Wizpig - unless the local animals can do something about it! So join Diddy Kong as he teams up with Timber the Tiger, Pipsy the Mouse and Taj the Genie in an epic racing adventure unlike anything you've ever experienced before!",88
Turok 2: Seeds of Evil,1998-12-10,M,"Turok 2 starts out poorly, but it does have some redeeming qualities.",86
F-Zero X,1998-09-30,E,"It's you against 29 other machines competing for the title of F-Zero X Champion. You're racing at speeds of over 1,000 km/h high above the atmosphere. Your competition comes from every corner of the galaxy and won't shed a tear at the thought of smashing you off the track. With four-player simultaneous gameplay and the Rumble Pak accessory, you have the fastest racing game on the N64 system!",85
Star Wars: Rogue Squadron 3D,1998-11-17,T,"If you enjoy a good shooter, you should give Rogue Squadron a try.",85
Turok: Dinosaur Hunter,1997-03-04,M,Playing this violent masterpiece - with its flashy arsenal of weapons and lifelike cretins - is a technically arresting adventure.,85
NFL Blitz 2000,1999-07-31,E,"It's back and it's better than ever! NFL Blitz 2000 adds 4-player support, new offensive and defensive plays, realistic weather conditions, new stadiums and a Tournament mode! Customize offensive and defensive plays to your liking. Call audibles at the line of scrimmage. You've got control now! Passing made easy with new &quot;Blitz Passing&quot; for one-touch long bombs! &quot;ON-FIRE&quot; mode gives super power performance to your players! With non-stop action and a &quot;pick-it-up-and-play&quot; learning curve, NFL BLITZ 2000 is THE game for every football fan!",85
Tony Hawk's Pro Skater 2,2001-08-21,E,"Tony Hawk's Pro Skater 2 redefined an already great game. Its addition of stellar new features (like Create-A-Park), and great game-play tweaks (the manual maneuver will be copied for years to come) made it the best installment in a killer series of games. Anyone who has ever skated the Philadelphia level will agree -- this game is a masterpiece of level design. Hell, it's a masterpiece all around. There isn't a bad park or dull moment, just pure gaming nirvana!",84
Wipeout 64,1998-11-03,E,"The fastest races. The deadliest weapons. The biggest name in anti-gravity racing descends on N64 with incredible new visual power and fully enhanced gameplay glory. With blistering races, challenges, time trials and a multiplay league, Wipeout 64 delivers pure racing devastation. Faster than you can imagine.",84
Star Wars: Episode I Battle for Naboo,2000-12-18,T,"Attention defenders of Naboo! The Trade Federation must be stopped! Storm through more than 15 missions over land, sea and space as your freedom fighters rally against the droid armies. Take control of 7 vehicles: the Naboo starfighter, Gian speeder, and new craft like the heavy STAP, Trade Federation gunboat and more. More than 15 missions: escape from Theed, search &amp; destroy, sabotage, reconnaissance, convoy. Battle against Trade Federation droid starfighters, AATs, destroyer droids, battle droids. 
Change vehicles mid-mission through specially designated hangars.",84
Space Station Silicon Valley,1998-10-21,E,"Silicon Valley was intended to be the most technologically advanced amusement park civilization has ever known. Shortly after take-off, it disappeared. Now, in the year 3000, it's back and on a collision course with Earth! It's up to you to conquer the 30 levels in four incredibly lavish environments, take control of the totally original, wacky and - at times - life threatening characters and unlock the mysteries of the Valley. It's all great fun but remember, the fate of the world is in your hands!",83
Mario Kart 64,1997-02-10,K,"Three... Two... One... GO! The signal light changes and you drop the pedal to the metal. Take on up to three friends in the split-screen VS games, or race solo in the Mario GP. Tell your friends to bring it on in the highly competitive Battle mode. Advanced features allow you to race with your &quot;Ghost&quot;. The driving data from your best run appears as a transparent character on the screen. No longer must you simply race against the clock - you can actually race against yourself!",83
Ridge Racer 64,2000-02-14,E,"Race into action with RR64! It's got all the fast-paced arcade action you've come to expect from the Ridge Racer name, plus extra features you've never seen before! Race with up to four players simultaneously on the same screen. Compete on never-before-seen tracks and witness amazing special effects. You've never seen a Ridge Racer like this! Choose from 25 cars and race on 9 different courses.",82
Extreme-G,1997-09-30,K,"Pit yourself against 12 laser-blasting speedfreaks across 12 looping, coiling, corkscrewing rollercoaster racetracks. If you've never seen a cyber-cycle take a stinger missile up the tailpipe during a blistering halfpipe you're about to get a rush of adrenaline. Racing to the Nth degree through gravitational extremes. Surfing the knife edge between G-force and burning wreckage! If gravity's a law, then this is a felony.",82
Ogre Battle 64: Person of Lordly Caliber,2000-10-07,T,The Holy Lodis Empire is planning the domination of the entire continent of Zeteginia! It is up to you to raise the flag of revolution and rid the land of the Lodis threat. Make decisions in real-time and take control of numerous characters to prove victorious on the battlefield and regain freedom for all people!,82
Wetrix,1998-06-30,E,"A rainstorm so fierce, it will keep you from leaving your home for the next six months. Wetrix just might be the most addictive puzzle game of all time. Using randomly shaped 3D blocks as they fall from the sky, you must create a series of lakes and dams before the heavy rains appear. Because if the water drains, you lose! Sound simple? Well, mix in a few natural disasters and bomb attacks, and suddenly you need to muster all your strategy and skill to combat nature's fury!",81
Pokemon Puzzle League,2000-09-01,E,"Discover the most frantic, frenzied, fun-filled Pok&eacute;mon challenge ever--Pok&eacute;mon Puzzle League! Line up three or more blocks of the same type to clear them off the screen. Create chains and combos to send garbage to your opponent. Collect badges from other Pok&eacute;mon trainers to earn the right to enter the ultimate competition... a battle against the mysterious Puzzle Master!",81
007: The World is not Enough,2000-11-01,T,"Experience the intensity of being the world's top secret agent. Equipped with a full arsenal of of Q-Lab gadgets and weaponry, you must be suave, resourceful, and lethal as you carry out action-packed missions based on the blockbuster movie. Are you cool under pressure? Deadly when necessary? Of course you are -- you're Bond...James Bond.",81
Jet Force Gemini,1999-10-11,T,"The insect invasion has begun... The galaxy is being infested by the evil Mizar and his horde of Drones. Already, the planet of Goldwood has been subjugated and the peaceful Tribals enslaved. With an arsenal of mega-weapons at their disposal, the Jet Force Gemini team must travel in search of Mizar's lair - rescuing Tribals and splattering Drones all along the way. But can Juno, Vela and their faithful dog, Lupus, exterminate the deadly threat before it's too late?",80
StarCraft 64,2000-06-12,T,"In the distant future, a small group of human exiles have been doomed to fight for their survival on the edge of the universe. Three powerful species, the Terrans, Protoss and Zerg, are locked in a fierce battle over the fate of the galaxy. The time for war has come. Manage resources, build armies, devise strategies and master the specialized technologies of each species as you enter a universe of unparalleled tactical excitement. Over 50 single-player missions, including new scenarios specially created for the N64.",80
Pilotwings 64,1996-09-29,K,Forget about those other flying games. This is the ultimate flight experience! Pilotwings 64 carries you off into a vast three-dimensional environment. Pilot several different vehicles and take in breathtaking sights! Successfully complete flight tests to earn your flight badge. Get a high enough score and you'll get a chance at bonus games such as Cannonball and Sky Diving! Soar into the wild blue yonder with Pilotwings 64!,80
Super Smash Bros.,1999-04-26,E,"It's a Bumpin', Bruisin', Brawlin' Bash! The many worlds of Nintendo collide in the ultimate showdown of strength and skill! Up to four players can choose their favorite characters - complete with signature attacks - and go at it in Team Battles and Free-For-Alls. Or venture out on your own to conquer the 14 stages in single-player mode. Either way, Super Smash Bros. is a no-holds-barred action-fest that will keep you coming back for more!",79
Mario Party,1999-02-08,E,"Tensions mount for Mario and pals as each declares himself to be the one true Super Star of Marioland. Face your friends and family in a contest of strength, wits and agility as you explore 6 thriling Adventure Boards. Reveal new levels of gaming excitement as you customize your boards with speed blocks, warp blocks and other specialty items. Jam-packed with all the electricity of an entire arcade, the action comes alive for up to 4 players. So grab your friends and get ready for a wild ride because this party never ends!",79
Harvest Moon 64,1999-11-30,E,"Retire to the country for a new challenge in Harvest Moon 64. Hard work is rewarded as you struggle to bring prosperity back to a neglected farm. Work the land, pick up odd-jobs, and get to know the neighbors. Harvest Moon 64 has all the charm of the original Super Nintendo classic, plus many new surprises.

* Tons of new seasonal vegetables and fruits.
* Raise cows, chickens, and sheep.
* New items and gifts. Including tools that increase in power as you master them.
* One of town's five eligible women may prove to be the love of your life.
* Celebrate seasonal festivals with the nearby townsfolk.
* Enjoy local horse and dog racing.",78
Pokemon Stadium 2,2001-03-28,E,Hundreds of Pok&eacute;mon in Three-mendous 3-D! What's sweeter than victory in a Pok&eacute;mon battle! Victory in a 3-D arena on the N64&trade;! Set your strategy and stand back while your Pok&eacute;mon battle it out. You can even set the Pok&eacute;mon you've trained--fully rendered in 3-D and ready for battle!,78
Castlevania (1998),1998-12-31,T,"Take control of Reinhardt Schneider, a whip-toting Vampire Killer who has waited his whole life to meet his destiny, or Carrie Fernandez, a young girl with a strong magical presence who is mysteriously drawn to Dracula's evil Castlevania. It is their duty to seek out Castlevania and put an end to its residents' plans. What is your destiny?",78
Army Men: Air Attack,2000-07-18,T,"Pilot one of four toy helicopters through the treacherous terrain of your backyard, the local playground, picnic areas and nearby beaches. Engage in both air-to-air and air-to-ground combat with enemies ranging from battleships to butterflies. Utilize the unique abilities of each 'copter to battle armies of mutant insects; destroy rampaging remote control cars; blow up sand castles; and save Sarge from being melted by kids with magnifying glasses. Real combat. Plastic men.",77
Pokemon Snap,1999-06-30,E,"The Professor has asked you to capture the Wild Pokémon of Pokémon island...on film! Tour the island in your ZERO-ONE vehicle and snap pictures of Pokémon in their natural habitat. Wild Pokémon are often camera-shy, so you'll have to use special items to bring them out in the open. Only the best shots will do for the Professor's Pokémon Report, so sharpen your photography skills and get ready to SNAP! 

* The first ever N64 game to feature the world-famous Pokémon -- fully rendered in 3-D! 
* Explore the many environments of Pokémon Island, like the sunny beach, the mysterious caves, and even a red-hot volcano! 
* Many different types of Pokémon inhabit the island. See how many you can catch on film! 
* Print your photos as stickers at Pokémon Snap Stations!",77
Turok 3: Shadow of Oblivion (2000),2000-09-06,M,"Finish the hunt in this epic finale to the Turok Trilogy. Pick up immediately after the events of Turok 2: Seeds of Evil, with dual protagonists Joseph and Danielle Fireseed, of the Turok family tree, as they battle the titular antagonist Oblivion and its followers, the Flesh Eaters.",77
Kirby 64: The Crystal Shards,2000-06-26,E,"Dart past enemies, soar the skies and swim the depths of the ocean as Kirby takes on Dark Matter in an all-new adventure. Inhale, exhale and swallow your enemies, then copy and combine their abilities and use them as your own! Team up with familiar friends and foes - like Waddle Dee and King Dedede - as you travel through dreamy worlds in search of the lost Crystal Shards.",77
Forsaken (1998),1998-04-30,M,"Forsaken is, at its core, a Descent clone. But stunning graphics, a dazzling array of weapons, and above-average level design make the whole thing seem fresh.",75
Indiana Jones and the Infernal Machine,2000-12-15,T,"1947. The nazis have been crushed, the Cold War has begun and Soviet agents are sniffing around an ancient ruin. Grab your whip and fedora and join Indy in a globespanning race to unearth the mysterious &quot;Infernal Machine&quot;. Survive the challenges of unusual beasts, half the Red Army and more (including - oh no - snakes!) . Puzzle your way through 17 chapters of an action-packed story. Travel the world to exotic locales, from the ruins of Babylon to Egyptian deserts. All the weapons you'll need, including firearms, explosives-and of course Indy's trusty whip and revolver.",75
World Driver Championship,1999-05-31,E,"Your passport to racing! Develop a racing career as you compete for job offers with each of the 15 World Driver Teams. Ten tracks located throughout the world. 20 challenging events spread across two different levels of competition. Over 30 highly detailed, exotic cars with realistic physics and handling! Race head-to-head in two-player split-screen mode. Save replay on the Contoller Pak to analyze your driving skills from multiple camera angles.",75
Mario Party 3,2001-05-06,E,"Mario and friends are throwing a party and you're invited. It's their biggest bash yet, with seventy totally new Mini-Games and five brand new adventure boards. You'll be the life of the party as you punch, pound and stampede right over your opponents in a multiplayer melee or go head-to-head in the new two-player duel mode. You can even unlock new characters in the one-player challenge. 

With so much fun and excitement, this is a bash you'll just have to crash!",74
Quake,1998-03-24,M,"Rage through 32 single player levels and 6 deathmatch levels of sheer terror and fully immersive sound and lighting. Arm yourself against the cannibalistic Ogre, fiendish Vore and indestructible Schambler using letal nails, fierce Thunderbolts and abominable Rocket and Grenade Launchers. [id Software]",74
Body Harvest,1998-10-20,T,"Earth is dead. Mankind annihilated. Hunted to extinction by a century of alien attacks. One last, desperate chance remains - CHANGE HISTORY. Someone must travel back in time and attack the alien predators before they complete their hideous invasion. Genetically enhanced marine, Adam Drake, must make the trip into the far reaches of Earth's history. His goal - stop the alien body harvest... Travel with Adam Drake through 5 incredible levels of action-packed adventure, spanning more than a century of Earth history!",73
Duke Nukem 3D,1997-11-16,M,"Prepare yourself for the ultimate 3D Slugfest. Murderous aliens have landed in futuristic Los Angeles, and the humans suddenly find themselves atop the endangered species list. The odds are a million-to-one. Just the way Duke likes it. Dive into realistic 3D scenarios, with 28 totally realistic levels, as you drive the sinister aliens through the streets of LA, out to an orbiting station, and onto the surface of the moon itself! An you'll be armed to the teeth with 10 hi-tech weapons. Clear crowds with the pump action Assault Shotgun, blast through enemies and walls with the Rocket Propelled Grenade, splat enemies under foot after blasting them with the Shrinker, cut through trouble with the 3-barel Ripper machine gun, set DukeMatch traps with the wall-mounted Laser Mine, watch enemies shatter after cooling them off with the Freeze Cannon, and 4 more! [FormGen]",73
