title,release_date,rating,description,metascore
Spider-Man (2000),2000-11-21,E,"He spins a web, swings across the sky and lands with a somersault onto the Daily Bugle building. Who is this masked hero? It's you! Fight, jump and web-sling as Spider-Man as you take on a legion of sinister villains. The city is depending on you.",72
Mickey's Speedway USA,2000-11-13,E,Buckle up and get ready to race! Rally across America with Mickey and friends! Race around 20 All-American courses - from Alaska to the Everglades - as you try to track down the Weasels and rescue poor dognapped Pluto. Use Ludwig Von Drake's wacky weapons - such as the &quot;Antigrav-o-Kit Magno Flyer&quot; or the &quot;Stormy Weather Whenever Engager&quot; - to give you the edge. Then blast past your friends and listen as the drivers taunt each other using Disney's original character voices!,71
Dr. Mario 64,2001-04-08,E,"It's a new outbreak of Dr. Mario madness! Dr. Mario's back, packing a prescription for fun--and now the frenzied action of the original gets even more frantic with all-new multiplayer modes! Up to four players can go head-to-head, or they can pair up to pile on capsules in Team Battle. Other options let 'em race against time in Score Attack, target flashing viruses in Flash Mode, or test endurance in Marathon play. There's even a new story mode that pits Mario against pilferers trying to profit from his Megavitamins. It's a puzzling epidemic, and Dr. Mario's got the cure!",71
1080: TenEighty Snowboarding,1998-03-31,E,"You're taking a Tahoe 155 snowboard down a steep, bumpy incline at night and you're about to top off an Indy Nosebone with a 360 Air, and you haven't even left your living room! You're playing 1080 (Ten Eighty) Snowboarding, a game so intense you'll be brushing the snow off your goggles. With five different boarders, eight different Lamar snowboards, more than 25 tricks, a Half-Pipe and six different courses, this is as close as you'll get to the real thing without hopping on the next ski lift.",70
Looney Tunes Duck Dodgers Starring Daffy Duck,2000-09-16,E,"Can you do it, Duck Dodgers? Can you save the Earth? Marvin the Martian has built the Ultimate Weapon to destroy our planet. But there's one small problem: Ultimate Weapons require a lot of energy that Marvin doesn't have. So he sends out his minions to search for energy atoms. It's up to you, Duck Dodgers, savior of the Universe (and master klutz), to stop Marvin before he collects enough atoms to make his diabolical plan a success. We're counting on you!",69
Mystical Ninja starring Goemon,1998-04-16,E,"A giant UFO has appeared over Oedo Castle, and the Mystical Ninja is off to save the world again! Control Goemon and his giant robot, Impact, Ebisimaru, a truly twisted ninja, Yae, the part-time militant mermaid, and Sasuke, a mechanical warrior. This brave band must travel from town to town, collecting information and purchasing helpful items in their quest to defeat the dreaded Peach Mountain Shoguns.",67
Yoshi's Story,1998-03-01,E,"Baby Bowser has taken the Super Happy Tree and cast a spell on Yoshi's world, turning it into the pages of a picture book. The only Yoshis not affected by the spell were six hatchlings that were still protected by their shells. It's up to them to reclaim the Super Happy Tree and restore happiness to the world. That is the only thing that can break Baby Bowser's spell!",65
Mission: Impossible (1998),1998-08-14,T,"Prepare to enter into the most demanding and dangerous Mission Impossible ever. Your mission, should you decide to accept it, will be to guide your team through a spectacular series of authorized worldwide missions encompassing over 20 levels of gameplay. Razor-sharp reflexes, the ability to make quick decisions, strategic thinking and an extremely high level of accuracy will prove essential. As always, should you, or any member of IM Force be caught or killed, the Secretary will disavow any knowledge of your actions. As usual, Ethan Hunt will be your point man. This game will not self-destruct in five seconds, but you may...",61
PGA European Tour,2000-06-15,E,"Realism, Authenticity, Sophistication and a European Touch! Play on four authentic European golf courses. Compete in European Tour and six non-tour modes. Genuine commentaries from BBC's famous Peter Allis. Go head-to-head with 64 established European stars. Realistic sound and weather effects. A true golf simulation with simple and intuitive feel.",58
"Hey You, Pikachu!",2000-11-06,E,"For the first time ever, you can actually talk to your favorite Pokémon. Tag along with Pikachu as it goes through its daily routines, taking field trips, going fishing and having picnics, becoming better friends with each passing day. Pikachu will hear and react to the words you say. The more you speak the closer friends you'll be! 

* Talk into the microphone, see Pikachu react. Your voice travels to Pikachu through the N64® Voice Recognition Unit and microphone -- both included. 
* Pal around with Pikachu -- together you'll gather cooking ingredients, fish for favorite water Pokémon, and even hunt for buried treasure on a deserted island. 
* Speak to Pikachu using a variety of keywords and phrases. Friendship is based on communication, and there's plenty to talk about!",57
NFL QB Club 2001,2000-08-24,E,"It's clear that NFL QB Club 2001 is trying to play catch up with Sega's NFL 2K series, and the way things stand, QB Club still has a lot of cleaning up to do before it can smell as rosy fresh as Sega's superior offerings.",57
Hercules: The Legendary Journeys,2000-11-16,T,"Take control of the legendary hero Hercules and his friends Iolaus and Serena as they attempt to stop Ares from completing his diabolical plans. Use each character's unique attributes: Hercules' legendary strength, Iolaus' nimble nature and Serena's accuracy to complete your quest. Travel through 12 unique fully 3D worlds, from the sunny seaside town of Porticus to the snowy mountains of Alpsius. Explore the bandit-overrun forrests of Traycus or heavenly Mount Olympus. Fight mythical terrifying monsters such as the Minotaur, Cyclops, and more!",55
Fighter Destiny 2,2000-07-14,T,"Enter the arena and do battle with the toughest, most skilled martial arts experts on the planet. As one of the international fighting elite, you'll vie to become the true authority of hand-to-hand combat. Your destiny awaits. Defeat any of your 11 opponents and gain their abilities. Launch 5 different modes of attack, from Training to Record Attack. Adjust scoring, ring sizes and difficulty settings. Compete in points-based martial arts tournaments. Force your opponent to relive defeat in instant replay. Gain new abilities and skills when you face the Master in the Fighter's Arena.",54
Aidyn Chronicles: The First Mage,2001-03-14,T,"Young Alaron is on a quest to discover the truth about himself, his name, and his heritage. Traveling to far and distant lands, pursued by forces he cannot understand, danger lurks around every corner. Alaron and his companions will seek to fulfill his destiny as the greatest mage ever known!",53
Army Men: Sarge's Heroes 2,2000-09-27,T,"THE BOYS ARE BACK AND READY TO DO BATTLE! Sarge and the Bravo Company Commandos managed to foil the Tan Army's first assault, but do they have what it takes this time? General Plastro has teamed up with Brigitte Bleu, a diabolically treacherous Blue Spy, to destroy the Green Nation once and for all. The adventure continues as Sarge and Vikki fight their way over pool tables, around a bedroom and across desktops to the final showdown against Plastro and his troops. Prepare for another gigantic battle! It's Real Combat. Plastic Men.",46
Cruis'n  Exotica,2000-10-16,E,Race in style! Cruis'n Exotica takes you to fantastic locales in even more fantastic vehicles. Race through steamy Jurassic jungles or on the ocean floor. Midair stunts keep the action nonstop! Valuable short-cuts and nitro boosts speed up the already fast-paced action!,43
Rally Challenge 2000,2000-06-30,E,"RALLY CHALLENGE 2000 takes you on a scorching tour around the world. Get behind the wheel of one of nine authentic WRC cars, each with its own unique settings for speed, torque and steering. Experience road rage of global proportions. Nasty weather and wicked terrain make even straightaways life-threatening. Go it alone or head-to-head with up to four players. Check out instant replay of all the action from multiple angles. Keep your road rage in check - collision damage could put you on the sidelines.",41
